{
  "date": "2026-06-01",
  "location": "Reno, NV",
  "weather": "Reno, NV: Mostly sunny this morning near 58\u00b0F, afternoon high around 84\u00b0F, light west wind, and dry conditions through evening.",
  "sections": {
    "local": [
      {
        "title": "Sherwin-Williams partnership enables outbound volume boost during peak - Trucking Dive",
        "url": "https://news.google.com/rss/articles/CBMisgFBVV95cUxQd2oyZUc5cHBUYU55bnhjR05oU0doajgtQUhIdVo1RzQ2eVZmR25TVk5QaVpzNVNhQXJRUllGNElrYmJ0TUxObm10bUFDQ0UyY2lXMkdBZ0VwMjdCa3lFMnN1UWVDYXo1ZXR4Tm5HaXJzSnpZR2FQZ1g5c0Y3TW4yVzBNZTdmVFR0WVpzWS1FZFRSMkQ5UXJoaUVHNnQ0ZE55NWx5WHpCWkkycExMR1JUQ193?oc=5",
        "source": "Trucking Dive"
      },
      {
        "title": "Local heat mitigation plans lack details on access to public drinking water - Nevada Current",
        "url": "https://news.google.com/rss/articles/CBMiswFBVV95cUxQM2N4Q2tSN0d6TTRXR1FlMXRyVTdYYTFHcGRVQlRiMThVajJiTV9QVlB4d0hMTjh4c09hY0tZYkhEd1V6ejFLY0o0em1jMHFZMzVPOEpvdHFaUGpuNjVzMmtvNDNpLW1PU0F1eFdCWmRlZnR6VjRCeThtb0VRM3c2NnVIbkcyTkM0S2Z2cXc0MDFPbnVZZlllM2RXSVdXN3NfWUt6RWdJOXJfQ1JxNEFVUzBYRQ?oc=5",
        "source": "Nevada Current"
      },
      {
        "title": "Gameday: River Cats 13, Aces 11 Final Score (05/31/2026) - MLB.com",
        "url": "https://news.google.com/rss/articles/CBMibEFVX3lxTFA5ZHlnYmNUcnpaSW1tUnh4akx2ODVZNGx6dmhFbmIwOElMTnduTHlCWVpJcTJYenpvZ2xob0I0SzFXa0c5djh1ZkZLMXhiSFV1cWd0bjg1cFdzOV9uY2plaklQNjZCajExTFdSeQ?oc=5",
        "source": "MLB.com"
      }
    ],
    "national": [
      {
        "title": "Tensions linger between Republicans and White House over the \u2018anti-weaponization\u2019 fund - AP News",
        "url": "https://news.google.com/rss/articles/CBMivgFBVV95cUxQaWRVOEN3a1JrNTk1dkpJQ0lhd0tFLTlob256VG41ZGk2b3hESXp5SmtWVVh0Vm55UVFKMlZPdE5Kby1LaGttNTBOd3RJbU14ZTZkbW5NZkVxVEl0aHRQU0pHRk04VmZDYU9SSm5zaGppY0N4cV9tZW9WZDFfb0cySHVMbG9LNDFGc000S2lTZGlnYWlnX2ItOXctSEhnbHFsQXlvVEpTVDUzSS1iald2ajEtNllzRG5VcERHOGl3?oc=5",
        "source": "AP News"
      },
      {
        "title": "U.S. bombs Iranian military sites and Kuwait is hit by drone and missile fire - NPR",
        "url": "https://news.google.com/rss/articles/CBMib0FVX3lxTE8zTjVOb2ExWlNjRldIU0cyamNHbUw4dkt4QnZtaGhQNzdjVzQtc2pnbFN3RXRCMGhqTlptdTE2cTlKZ3NheF9pTEFKV3RqNGpuY2h4bDNmMXZlNG5rQkVxeVozUFI5dm5sd1FEQ3N3QQ?oc=5",
        "source": "NPR"
      },
      {
        "title": "Graham Platner tests Democrats' tolerance for scandal - Axios",
        "url": "https://news.google.com/rss/articles/CBMigwFBVV95cUxNLUtJUEphdTJfclVhWWp1QVE5aU54eVZqd0h3RlkxMkFVMnZnTFl5UlFrNmxlV01hZS05X3cxMGpHZzVQcUhOakx3SnVCeGlXVEVNRThBVGw0cDZ4cXpWc1NHMG9jMTFGTGdRWGdlQzE4MzIyT0JVVjlJU2Q0QWNOQ0VPWQ?oc=5",
        "source": "Axios"
      }
    ],
    "global": [
      {
        "title": "Colombia\u2019s Petro sows doubt about election showing his favored successor heading to runoff against pro-Trump rival - NBC News",
        "url": "https://news.google.com/rss/articles/CBMingFBVV95cUxOdGQ3NmxiTlczS2pnb1h5T2Q4S1BCLTlCZURlRjNROHFJQlFCS1hoajBBdzJPRDZULTl6dkpveXZkOGZJYUdxWktfMk5LY1EzbEFzazJ4aDZvSE9hOE4tR1p1cFAtbWtIYmxwc0pYZEFOWnpmSk0wMFBaZENVWjVpcXlXRTI3NzlCQ3B5MnpvRkRHNDhXZElBXzZWUUI0dw?oc=5",
        "source": "NBC News"
      },
      {
        "title": "U.S. push for Lebanon ceasefire stalls as Israel eyes Beirut strikes - Axios",
        "url": "https://news.google.com/rss/articles/CBMie0FVX3lxTE1xMUc0U2JuLWRCbm9ILVc0enYyVVJ4V1kwWklYZmF5ZV9UcUtoMUtMZXp1UTFzdnFZY0ZNa2tQMGkwZm1MY21ITlgzUFY2UUZWSU0wX3FkR3NReWpmSXlOMW5rTzdaeGxibFVpVU9DSFRESVEtVkJzajNiQQ?oc=5",
        "source": "Axios"
      },
      {
        "title": "The bad news keeps coming for Keir Starmer with new trove of Mandelson files due to be published - AP News",
        "url": "https://news.google.com/rss/articles/CBMiqAFBVV95cUxNVnZvdXRpV3ZWTEx0bGRUWUI4b21rVTdoUm5ZdHN3WnhpWmhKNTd6bS1FZnJ1ekJxMlZCMVlacjBKd29kUndjUHNzbTByOUJSRW5HR29FQWlKR3k0OXRkTWlKdVB3SS1yY2Z5WTZoR1BmSjNuejRmY0dlM3JWOU5uRDFxbzExamFDZ093VVJtbVFfekN6Q0JTNjBaU1A1RXFxMUxtX1NTTWo?oc=5",
        "source": "AP News"
      }
    ],
    "tech": [
      {
        "title": "Arm, IBM and Hewlett Packard soar as Nvidia chip 'reinvention' extends software rally - CNBC",
        "url": "https://news.google.com/rss/articles/CBMioAFBVV95cUxNaERvOWlCZXlZM3RhcVMtSlBCQmZtWlVZZXBSQU95UFRqOVptcUdydTdrN0lvSkRIVUlXU0xHZmtIVU9vanNfSHJPTEM4bDBfRWV0bW1RLVJiTUxuRERUUEZKb3dnaFdnNjNBUkpjbDdwZ296Z3hPVm9LbGRDR0pzT3FNMU9zanNtTklGbVVyeTIzek5EbEVXc0lObnZXeURm0gGmAUFVX3lxTFAxM0NvdFkxZ3g0dVYtT2N2dU0xNE9vVUpYZWRWYm9WaU9KbEJIYlpWOEZkRnFfRlhBQjEtSTVYTFQwclpqYzYxZnY3eTBjeGVETkR2eGpGVEpjTnRlRjhKSmdWWFNCLW1MZm5QMHFCNDZtMWhRbE8xdGh5dnJTSU91WEJYZVo3RDVYM0dOQkVya1JYVUk5SmR3MnpsdGpxcllLanlJWGc?oc=5",
        "source": "CNBC"
      },
      {
        "title": "ASUS' ROG Xbox Ally X20 bundle includes a limited-edition OLED Ally X handheld PC and AR gaming glasses - Engadget",
        "url": "https://news.google.com/rss/articles/CBMi0gFBVV95cUxQZFphVjdFUEFwdk9sSlc5QTE0VW4tV1hILWxpajhlTWVFU3J4ZlBBVVBCdWl5Z1l2bFBhajhCUkV0VGptd21RcjdQakwyeWlUOWNralBHV3dmQWZ1NHF5OTktX1kwcEVGMmlKYXp4TEFNSDNNOWJKR3NiZE9TZDQzd0VreGJla2haT1NtbmFENEtRVFdzcDhCZ3pTaEdIeXlIc3pNbmYybnlXNG10eE1VS2dfcS05OVA1SnRFcmRZbTJ3SnVIbUpCUm9VUjBVRmtaZmc?oc=5",
        "source": "Engadget"
      },
      {
        "title": "Apple's Smart Glasses Reportedly Delayed Until Late 2027 - CNET",
        "url": "https://news.google.com/rss/articles/CBMiigFBVV95cUxQdTJmWEFiSU9wTDNlOWhCRFBuZHJHcDdIbkVaa2hFUGp5WkZRNnJOaUdVeVVEaWVhVUFiRnRIY0NHaWltYzA4dHlCZDM5VDVrTGRObkc5akZhVndQZTlTZjYxeElGeUNJR0VHN3N6dl8xSlNJV0FQVjFKdWU1dzJMU2RPY29LRjBoQ2c?oc=5",
        "source": "CNET"
      }
    ]
  },
  "guitarExercise": "15-minute exercise: In A minor pentatonic, play 3-note groupings across all five positions at 90 BPM for 8 minutes with strict alternate picking; finish with 7 minutes of bend intonation + controlled vibrato on strings 2 and 3.",
  "codingPrompt": "Principal-level problem: Design a deterministic, multi-region workflow orchestration control plane for AI agents with replay-safe execution and exactly-once external side effects. Specify architecture, idempotency strategy, consistency model, tenant isolation, policy gates, SLOs, and zero-downtime migration.",
  "quote": {
    "text": "You do not rise to the level of your goals. You fall to the level of your systems.",
    "author": "James Clear"
  },
  "audio": {
    "src": "./brief-podcast.mp3",
    "maxMinutes": 6
  }
}
