{
  "date": "2026-05-11",
  "location": "Reno, NV",
  "weather": "Reno, NV: Cool clear morning around 48\u00b0F, afternoon high near 74\u00b0F, light breeze, dry conditions.",
  "sections": {
    "local": [
      {
        "title": "Reno hospitals score high in latest national safety report - Reno Gazette Journal",
        "url": "https://news.google.com/rss/articles/CBMijAFBVV95cUxQZTVvQjZCR2tDVy1pZWwwUWlDWmxVa2M5V2xpdjdjRk90NlpVSEhvd0hOZnFNa2lmN1NrWGs1N1ItVXJBcEJ0c3dtSkN2aVJRY2xPUDJZRkF6RUJ6bXRLbzVBbjFMMTdaeHJfbTlob3pNTklQRHU1RzRfVlZXTkV3ajdmN1N4RkhXd1Q3VA?oc=5",
        "source": "Reno Gazette Journal"
      },
      {
        "title": "Reno Aces vs Las Vegas Aviators | May 12-17 | Reno Tahoe - Visit Reno Tahoe",
        "url": "https://news.google.com/rss/articles/CBMiqwFBVV95cUxOUFRwekZ2eHJTR3M4aXBRWmN6WGZjTnU1UzZva2pub1Q3UVYtR0N6YktXRVRJSnhRdllqYXN3dmQ0a3RnRWZ0d3o4eUxHNXo0Nk5VbDlDd1hrU2pqMU5Fd1NNWnVqb2d6TllXX1FtSFhrV1g5eXRXZ0cxLWU0WUM5N3h5Q2pKQm9taExVSXVIQ0daY2E5SzVuSllSMEhULWRzdWxHLWJfTnZpWnc?oc=5",
        "source": "Visit Reno Tahoe"
      },
      {
        "title": "Reno events this week: Learn about the Hopi Tribe, local birds and local brews - This Is Reno",
        "url": "https://news.google.com/rss/articles/CBMickFVX3lxTE8zV29ObkxuVDJkWEdxT0pseUhrdTZNb2dqMUtkdDhacWtEN0JMWUxPOGVfdXZXblBzZXd0dVd1cTZiVzFxVC14NFY1VFJuaGp1b3JmeTNNcE5HTU1tbkNCenlwTTFBZWFOOEhTMDRfZ2NwQQ?oc=5",
        "source": "This Is Reno"
      }
    ],
    "national": [
      {
        "title": "Confident in China\u2019s power, Xi is ready to host an unpredictable Trump - The Washington Post",
        "url": "https://news.google.com/rss/articles/CBMigwFBVV95cUxPM3FUSlMzNWtPRGw1d3JkV3k1WTRrMDh0ZXB5Z2VCempXbHlPMTB4QVZ6QW1vZ1JENVo0SnpYTFVWWTJSSm9BSlh5Y0JibGtWQmZNcHVDZHQyOEhQVlF2dUw0X3FnNjVUbFlTLTVKajloOERianVLcmlxQlQ1N2xGYzlHcw?oc=5",
        "source": "The Washington Post"
      },
      {
        "title": "Six people confirmed dead in Union Pacific cargo train at Laredo railyard - WOAI",
        "url": "https://news.google.com/rss/articles/CBMi4wFBVV95cUxOcmdVaXdHdUQycWhxVXFXbC03U1gwQnJaYjluR005SGpaMEhUVlJSejVTNmdNRmNDWFM4S2t5UjI1aU9jNkZFM3RJLThDdEx3aGxEWVh5NGtDM0dkTkZKY0NMRFRGTTlTN1hWeVNKek9naVhtN0lRR04tZnZiV3dsY2cxSXgtaGVkZkJ6Z3l6dEl0S1pFeEUzSmppcVJqWWNVMkRSTVZpSkpsTVU2WktqYXlPNEdXYUQxdEF5TWdEaHNHY0VNVmhOQVFDNnNRV0RZYThkRlFucHMzZjd2VklGc29fVQ?oc=5",
        "source": "WOAI"
      },
      {
        "title": "Trump to Axios: \"I don't like\" Iran's peace plan response - Axios",
        "url": "https://news.google.com/rss/articles/CBMilgFBVV95cUxNNU1FNEJZdmZzSXYxcFlFREZCaUNIR2VqR2ZmZTlndVJyaFVhbWhkWWUxWGt5bkFEWGhPSHhPWnVMQ2sxT0IxWVgxUU5idVZGSVBBQk9QdGRxUURxRFFMUWhFYzFVY0x1ZkxQY09lSWl4bWhIQ0RuTEJWaGVyNTE5NUtoSnI0RDV3XzJXZzRrZng1UDRaamc?oc=5",
        "source": "Axios"
      }
    ],
    "global": [
      {
        "title": "US and French nationals test positive for hantavirus after leaving ship - BBC",
        "url": "https://news.google.com/rss/articles/CBMiWkFVX3lxTFBFY3oydExDUlVxYVNReUU3NDhNMjBYYVhYYzFNcGxlVjJick1zcFJfX2M0dTAwZnY1VExDaGd2Vm1wWGxRWjREcmE1djNjYjNJZldIUjNZNnZ6QQ?oc=5",
        "source": "BBC"
      },
      {
        "title": "Starmer pledges to bring Britain closer to the EU as he faces calls to step down - AP News",
        "url": "https://news.google.com/rss/articles/CBMiqAFBVV95cUxQMzhxRHlHV005VWtsbEFTZVNsS2J1RW1zNU1Rd18yeTB1WVVLZXd6VTRnVWFUYUpONldrdGFfRXpMVUlabmdFbE9nMDFwcWhkUFZZeFE0Z3VVWlIxcFdENF9LaG10VTdYLXFIeG83NUItbGQyTXJtcWtndWI3X1E2TmxjX2FVTUwtS1NzUzNPZkhmRTFFSGxPbDBEbEpJLVhjU0p1Q3J5ZHM?oc=5",
        "source": "AP News"
      },
      {
        "title": "EU\u2019s Kallas rejects Gerhard Schr\u00f6der as Russia-Ukraine negotiator - politico.eu",
        "url": "https://news.google.com/rss/articles/CBMinwFBVV95cUxOSjJRLXk2VjZRcmkwbjZ5dlZlTVk1MDFuVnN2TUpSNWNCYzhsUDg4RkkxVlpObVpkdjdZVGpDSWVSVlIxeF82eGNPem1GU3dyLXNyVWJtZ180OUtYOFFzWU9LSW1PZ3E3aE1fcjhCR1hXWWtWTXdSNTBtcGlzNzVJd01STDRqVEV5eFpUajgyeWJFRTQyMDhxUmE4RWc5VmM?oc=5",
        "source": "politico.eu"
      }
    ],
    "tech": [
      {
        "title": "Breaking: Samsung starts rolling out stable One UI 8.5 to Galaxy S25 users in the US - Android Authority",
        "url": "https://news.google.com/rss/articles/CBMiigFBVV95cUxNZW9jMS15QU9MSjlXeF9COHNmaXF2bXdWcVNfT3E1c2l4REdyM0FIWDkyVXZRNUNVQk52WXJpV3d0V0ZiZERab1d5bFNxUzdXb3BHU1R3SW0xMkhtcy15WGI5dW1rdjdqbE1keEl2WHVPWWp0eERyN3F0ZXRMVHg5aHRvMmFNc25ZcVE?oc=5",
        "source": "Android Authority"
      },
      {
        "title": "Fitbit Air has status light & double-tap gesture, gets Whoop size comparison - 9to5Google",
        "url": "https://news.google.com/rss/articles/CBMiZ0FVX3lxTE80TFVFRXJvMTZJdEYzdUVmZzNwNlYzdGtiYmZIU1ZSUUpHckItSDJVTjI1N1dkaDJjd29uLXBwZmhqTDFtMklVbmNoTzNiRGVLOER5MHp3aXNIWWRzU3dfZVlMZG5aVjA?oc=5",
        "source": "9to5Google"
      },
      {
        "title": "Discord adds a free Xbox Game Pass \u2018starter edition\u2019 for Nitro subscribers - The Verge",
        "url": "https://news.google.com/rss/articles/CBMimAFBVV95cUxNUHVRX1dQdUhUc2NuWEFBWE93UkwxV2FQWnp2a04tVi1odDBtZmxUdEx3NWl6eHYtb25zTnBxUnROVWhDNmhsX293bnMzc3pvQ2FQV2wyRGdFS29RN2JUZW9hWk96U3M0bW9HeU5RWmUxdTl1bjVpWVBUajZtT2E0a1RvT08wYU4tMW9ITGJ5NVVTTkIyQm1Deg?oc=5",
        "source": "The Verge"
      }
    ]
  },
  "guitarExercise": "15-minute CAGED transitions in G major: cycle I\u2013V\u2013vi\u2013IV across 5 positions at 70 BPM, then improvise chord-tone melodies for 5 minutes with strict time.",
  "codingPrompt": "Design a principal-level deterministic workflow orchestration platform for multi-tenant AI agents that guarantees idempotent side effects across retries and regional failover. Specify architecture, consistency model, state machine invariants, scheduling, observability, and disaster recovery.",
  "quote": {
    "text": "Success is the sum of small efforts, repeated day in and day out.",
    "author": "Robert Collier"
  },
  "audio": {
    "src": "./brief-podcast.mp3",
    "maxMinutes": 6
  }
}
