{
  "date": "2026-05-23",
  "location": "Reno, NV",
  "weather": "Reno, NV: Clear and cool morning around 51\u00b0F, high near 79\u00b0F this afternoon, light winds, dry conditions through evening.",
  "sections": {
    "local": [
      {
        "title": "Reno police officer was found dead at home on Thursday - KOLO | 8 News Now",
        "url": "https://news.google.com/rss/articles/CBMif0FVX3lxTE93Qkt2RmUzRGFRUFQxTVd3UVdROFZaSzdyMG5OQ1RfUVF4dkFuZTlITzA4ZzdxNE94ZzRpanlEVXg1dElLQ1p1UmM2dkV1c1JQaUJBY1dGMnFoNVFOMDFSV1Zzelk5VmZSZHJES2JhZUpWSmdlU1NiUkJFQUtTcjg?oc=5",
        "source": "KOLO | 8 News Now"
      },
      {
        "title": "Conference held in memory of mathematician Ilya Zaliapin - University of Nevada, Reno",
        "url": "https://news.google.com/rss/articles/CBMiggFBVV95cUxOVnFrMEdodXhaNWJUZ2J3eTByUENjbUlLbDNPdTdwLWRMZjN1Z2NNNEJuR2Q5Y3RPYmJnOHY3VUdIMTFxRi1adTBGWTItSUFlNmk0MGtKZ19RZFplRjg4Mk5IVWdqZjAtemhIWVlOTWhvSjkwZ05zV0FiYkRVWjJNMkxR?oc=5",
        "source": "University of Nevada, Reno"
      },
      {
        "title": "5/22 - 2 Plus You Nevada - Girl Scouts, Nevada Department of Wildlife, Food for Kids, Plus More! - KTVN",
        "url": "https://news.google.com/rss/articles/CBMi7wFBVV95cUxOYndiem9fczlMYkZhNFY3QXVyQ1BIaTBoSU0wM05wMmZVMFZuYzYzTTFpMVJ6NnJ6WDlHc2xmY1RfUl9ZWlZvN1Y4dzhMSVNyV2ptd2xhRDl0TW9LQ2RMTzJoWG0zcU94NmVaZVlxN0g3RlpRNE9Pc1NtRzJMem1CdHd0eWszdUVuanlMc1B5RG5Od1REXzFCZzFiQjNpQk5saEZpcFJQd3ZuWmtjM0N6RVhUQnNWWjJGWkx2WTYyMEtUb0tJNnV6SDllQmliYTZkTGhVR2NxazRwRUlmY1RZazg0aWZ3djF0QmpfcWxvOA?oc=5",
        "source": "KTVN"
      }
    ],
    "national": [
      {
        "title": "Live updates: Tank leaking toxic chemicals in Orange County will spill or explode, officials say - ABC7 Los Angeles",
        "url": "https://news.google.com/rss/articles/CBMi4AFBVV95cUxQV0VpTXBmZUhNbENkWFIyb0JwS3NDU2xxcWpqdTFzTk0xQjJtQW1ER0pYM05XZ2xoUEZQMDNKUGZDT1E2YUFSZkxyWkU1UlhVNnBlSXpiekNCNEl0cG9Ib19BNGRrSTBtR0E4b2R4NVRQMklVOUFZUWIxREQwMHVYZGlnY0ZhLXNIa0xnUVlTZWtDVEQtRF85WDZ0UmRmcHpMaUJBa2M0V0Fhel9mTGFNZWJHV3JaNnVRckVkaXVNS1RXaE9BaXpaODdGMkZPVkdTeHRNeTZaOEJhaXhiQXNkRA?oc=5",
        "source": "ABC7 Los Angeles"
      },
      {
        "title": "Police ordered guns to be removed from mosque shooter\u2019s home in 2025 - The Washington Post",
        "url": "https://news.google.com/rss/articles/CBMiqgFBVV95cUxPZ241aC1MeHU2SWJ2Q0h3XzBGT0U1TzBWNTJnWmlGLW1zWDUyOGFxUGRHZ3JNeXU1NEhYTDFORENaMVlxaHhTUklhR1daQUFrTzMtR3lZQUtmZlZ6blItOXVhTjNmOV81REZxNkRPX0FDMHBJV0ducnJBU2VDeXo4M1VSUl90R3VFOGM4VmRLN1RKbG1NQ0dsRmJNbzR6ZGk1a1p3M3diVUpxUQ?oc=5",
        "source": "The Washington Post"
      },
      {
        "title": "Food, Flashlights and Fans: Floridians Step Up Aid to Cuban Relatives - The New York Times",
        "url": "https://news.google.com/rss/articles/CBMid0FVX3lxTE9OdHpFZkxEb2F1amRCdXRfejVtWjVWejNQcWl1S3pkZmVqYlVRUWczci1XQnljVmVyV2x1MG5IN3lGajFQOG5ISURPczV0N1F0b3JkdDVuYTc2dTRsT0wxUm9rZ0g0S1JrenF0enE5Njkxd2xGQ2Nj?oc=5",
        "source": "The New York Times"
      }
    ],
    "global": [
      {
        "title": "Coal mine explosion in China kills 90 people, state media say - AP News",
        "url": "https://news.google.com/rss/articles/CBMilwFBVV95cUxPRGg0MlRlMmZudW5MUGNfb2VFb0pYX0dUcDVoZFJaNVZMWTFJSXVMVmJ2ZzFCZ2Y2N1FnTFExVk5yZzBYdlBLeGhnN3JuLXNubUJqLWpRSDJ6RmZQZ2EyRUtGM3JqbWFkY0lQa2E5ek80VjJBcFNtc3R1d0YyUWswUFhtOC12ZnBFMlhPQmh1VVNNRUdzWUlj?oc=5",
        "source": "AP News"
      },
      {
        "title": "The remains of 4 Italian divers killed in a Maldives cave dive have been repatriated - AP News",
        "url": "https://news.google.com/rss/articles/CBMipAFBVV95cUxQb3BMcWQ0SThXWjRQNVA4TTY3SU9kbXRyNWxfRG1lY2FMRHlsQkFUaG83ZkdmUXY1enFiWUcwVk9adHJpMml2bFRNS0FOdng2a2tDdDNkd2ZZZmZVQkFBazlIMldiZm8tUDdzQU9pZTBXQkIyallBcTZUdTc0ZHpCWGZSZFc3S2ZRNm1mTkMxa2EyS09JVS1oUjN4cDBPSjA5aWktZw?oc=5",
        "source": "AP News"
      },
      {
        "title": "Chile's MAGA-inspired border control - NPR",
        "url": "https://news.google.com/rss/articles/CBMihgFBVV95cUxOdmd6ZXM4OTNWZFBsUkZ5WkxhTllPVURZNDIwTWpaZWhETXIyVEp4NklPbExLSzBSVlZ2Ti1WNTZqT1l5MjJ4TzNjY01kMG14OTFad1JEX2R4S1lHOE9oN1NiRW9Tam93SXVlcDlrcFRrNXp0YmtXYm1ZeGFpRHh6UlZUWlB2Zw?oc=5",
        "source": "NPR"
      }
    ],
    "tech": [
      {
        "title": "I have a new go-to browser - The Verge",
        "url": "https://news.google.com/rss/articles/CBMigAFBVV95cUxNVFkzSW1OVzlCVHdkaTFFWjg2MUFVT25nVTRBZzJXVXBqeHBkWVpjd0NlcDNZSzNzcEFUbko4Q0lYT0s2WTZoa1ZEU2p1YUdRNEkwZlRTR0dncUI0dThFQV9waUNOZEY3ZDNDTmpHc29wZTY3a1FxYmJUbnpmd29qNw?oc=5",
        "source": "The Verge"
      },
      {
        "title": "Gemini app for Mac adding \u2018Spark\u2019 agent and voice control this summer - 9to5Google",
        "url": "https://news.google.com/rss/articles/CBMidEFVX3lxTE5Lbl9tcXBrazhiWHpOY1UzN0l2cjJHalNUT2lNY1RDUzh0N2QzRE43ZnY2bW9NMmVXV01LelAtbUdleGRvTmlfMEVvYWZnSTVVUW1tamFMU084ajRKYzg0TDZLeDVIU0d6czE1a3dEYVJkSmNX?oc=5",
        "source": "9to5Google"
      },
      {
        "title": "iPhone 18 Pro leak reveals brand new colors that could be coming - 9to5Mac",
        "url": "https://news.google.com/rss/articles/CBMinAFBVV95cUxQdWdUeGdKMU8zM3ZkVnUwdEdWTjNJem12UVFjN2JDX05BVGJYZERlMHZial9VcHlsbWhnS2Y1ZDZoQ3N0NXUxNWNvdDVlbmk0d2FKemJPWVhZc3JCZHR0cElUXy1JbzZpcjNtNFdyNHpHOXdwWXFUd1NUNHllNDZaclJQNFNzSXRZWE5sZTdSMDBQTzdmRnVQcjdNVV8?oc=5",
        "source": "9to5Mac"
      }
    ]
  },
  "guitarExercise": "15-minute exercise: E minor 3-notes-per-string alternate picking at 96-112 BPM for 8 minutes, then 7 minutes of chord-tone targeting over Em9-A13 with strict muting.",
  "codingPrompt": "Principal-level problem: Design a deterministic multi-region workflow control plane for AI agents with replay-safe execution, exactly-once side effects, tenant isolation, policy approvals, and cost-aware scheduling. Define architecture, invariants, consistency model, failure handling, SLOs, and migration strategy.",
  "quote": {
    "text": "Excellence is never an accident. It is always the result of high intention, sincere effort, and intelligent execution.",
    "author": "Aristotle"
  },
  "audio": {
    "src": "./brief-podcast.mp3",
    "maxMinutes": 6
  }
}
