{
  "date": "2026-05-19",
  "location": "Reno, NV",
  "weather": "Reno, NV: Sunny and cool morning near 51\u00b0F, warming to around 77\u00b0F this afternoon, light breeze, dry conditions.",
  "sections": {
    "local": [
      {
        "title": "Junk King Reno Expands Home Cleanout Services For Seniors Amid Downsizing Trend - markets.businessinsider.com",
        "url": "https://news.google.com/rss/articles/CBMi1AFBVV95cUxOUEFfdDZ2N3RvN0pUcEFnMXhUUTU2b0xMSGg1WGxFZzUxNWYzZnVfVElYNDlYVWY2bzg2RnJISGZaeUllTDUxbFd6RklvTHNKMm5SaXppU0VGUVBTZnhpNzRFUWVLLUZBTEFrRTZFcU1zNFVTcmZFREpGS3JSSGQxYXVQQ2dlWHJYWEtpeXVsbHR0X09FQk1LdVhaNGxaaFJSMUc0OXc0NW9hYXNMMjBOYWlnVGVuMlljUF84aFVsbTU5MWhjZ3EzOF9BanRPTlU2eXhLcQ?oc=5",
        "source": "markets.businessinsider.com"
      },
      {
        "title": "55-Story Tower could become Reno\u2019s tallest building in J Resort plans - KTVN",
        "url": "https://news.google.com/rss/articles/CBMi5wFBVV95cUxNN2JMVWJnRkplUDhMWUFTVWw3MmN3WjZQYkQtd1BZeDVQSDJwN3dPVXNTTHh5MVVkRnRoMnA4T2pRSWRNQlAwYWRlWGRkZi1MdVRDQW5SRG5vM3hGbVQtVzNTZGZpUUpORWxkeWxXZ2g4aXA2eVU3anpqOHpjd21yMjhIdHZweFJJVUhBdVd3VnZXU3NWTHg1MFFnX2FCSVVkVmFOZzJzOXAzSDZxb1Y4Z2I2N1B2LUR0MmtGai1pUURJMklzUWpvWlk2ZmV5Y19tbUc3eGFjaXdRX1NHc2ZJVWEwTkR3ZTg?oc=5",
        "source": "KTVN"
      },
      {
        "title": "Riley Gillis graduates with a successful academic career - University of Nevada, Reno",
        "url": "https://news.google.com/rss/articles/CBMibEFVX3lxTE1rVGtTN0x2dGItOExOdVJ2a2dhM3dmYU9wYzFXV2hyYTRDUHN5YjdYRW1pSWtvM2ZSSm5oaS1ZcWdMZlZ1QkhaRC11SzBhRmlGR05DYWRqTmtHZllTVVMtbmtSX2tmaEk0ZTB4LQ?oc=5",
        "source": "University of Nevada, Reno"
      }
    ],
    "national": [
      {
        "title": "Mother\u2019s call to police sparked urgent search before San Diego mosque shooting - The Washington Post",
        "url": "https://news.google.com/rss/articles/CBMilwFBVV95cUxNNWFaNEI5R2dGVm5QYW1BR09RMHVYdnBjdUNrVXFWbmpJUlc5YjJBcjlaR3hkNTdnWHlDelY2UmJyMHpoLXVDUFlsbnVjWmNiZV9YM240OUdDVjRkMjdlSUpIemRWYkw2SUUyWlM2Q2Z4dnRuWDhaMDFWMFRuSkxlNTluX05xcHBhM2NVRHpFTTdfQ1RHRi1J?oc=5",
        "source": "The Washington Post"
      },
      {
        "title": "What to know about today's primaries in Georgia, Kentucky, Pennsylvania and more - CBS News",
        "url": "https://news.google.com/rss/articles/CBMiqgFBVV95cUxNRFVIcjdWVWUyWVFzNXI1RFdyVnNXNFU0OWZYQkVLVFVSUUFXdG1XcmtyOXhzUVB1SzVhT1JUdk5XeXFmWkhBMWpzWWoxSkJzZmNOMVJYUFJBcnpJbWV3emlrREkyWmxDNE91WUtRd3pZaVFpcFNvMGtWRUxKNjA0MGF1ZVRZRnE0UlNWb2Z6N1ZzQXg2V0FfOTNXOFZzQlQtbzRoWmMweFY2UdIBrwFBVV95cUxNOEdjZlh6OElaaU5yT1RHMHFDWnVzaFFFbGJyM085TVhZR1hOUnFWeGp6QXJ0Z29jbi03Zl9BRWJRWlNUQ1dxWHJ5Z3kzYldpNTBxb0thUk5GUVU4RmtBM3N2N3pjTWs2eUJHM2lDdERXcm9sRkFJMUt0MC1WS1l1dnpVa2lBcU0yTGtJcHpfYUFZMkZqanVvY0JzLVJpRUo0TFVueFJMYUFKRFFJNmgw?oc=5",
        "source": "CBS News"
      },
      {
        "title": "Trump\u2019s Push to Defeat Massie Is the Most Expensive House Primary in Recent Years - The New York Times",
        "url": "https://news.google.com/rss/articles/CBMilAFBVV95cUxPYVAxSDhsd01vanQ4WjdsT3ZIQllMRVhwazhEUTJGbXU4UDVOQWNIZk8xZEpKVjQ0WFpQRU5MN09BdE42SmpKVU1MVUd6WC1kV3NRUkd0M1EyMVRvTEUxaWNhbGJhbVhVUXYzRmsyb3lPTlA2eThpNGg2LTdfUGRrZEFqMUF5VTM3NjRORkU1eUZPUXh2?oc=5",
        "source": "The New York Times"
      }
    ],
    "global": [
      {
        "title": "Middle East on Edge After Trump Says He Delayed Attack on Iran - The New York Times",
        "url": "https://news.google.com/rss/articles/CBMigAFBVV95cUxOM3NBLTVVeXRBOEdvZE1CbTcwdUk1YmlBMGJlaWJfWHRNUTBnY3Q2ZFVNOGx3d2N1SFQzN0MtZTlyb2ZNTmZ1MXBQTTREdDlrWmlIanJQOFRILTF3Mi15SkxfTWFLZnVCMUs1QzhLZHB6Q3RWRTgwZ09OSEI2ZF95cQ?oc=5",
        "source": "The New York Times"
      },
      {
        "title": "American tests positive for Ebola; U.S. to screen travelers at airports - The Washington Post",
        "url": "https://news.google.com/rss/articles/CBMiuwFBVV95cUxNYW5FTWdWSWpjMGowc3NfWHM4UWlrUy1vZlFfMlh4bDFqdHc1NzhGX3o3MjcwaExJNkQ1SDRVdHVPbkMtcmhkSkpiN2pMQXBueXFVRERnXzFKeTZXSEJKVk05c3JNU0lmQ29oeG5IeVM0RkFvcF9SMFBrVTFicWlZN2Z4VXFxUDJzNHROZ0s5OUJReWlQa01FeVBwR0tfdllWSGpMajh2dGFnZGtLcmNRdnYyUFlDY2NaZjJv?oc=5",
        "source": "The Washington Post"
      },
      {
        "title": "Iran says its new proposal demands reparations, US troop withdrawal, end to Lebanon war - The Times of Israel",
        "url": "https://news.google.com/rss/articles/CBMiswFBVV95cUxOWmtKdm4yYWRqZVZ3ZmdBLU5nbE04RGxCdHNrSmhGNnJoZ0JMMHctUHAtSjJxMUszbkdWQUlpM2tCVG5CcVI2QXBwdDBFVHBhTVdvcDk0RmM1OEJGZWhvc2NpVExYdHNab2tRX1AzRGhNcXdBQWp3aG1pNldWYk16em9CMk1aM1JFVURJdG9aMnNaR3NHZVFTMng3VElTT1d2NFowQl9CVlZfUHN4WjNOMEM1UdIBuAFBVV95cUxOWGMtSkk2aEFDcjYweUtWeGFSM0RVYVRjU1hhalA1TlFET255bE1uaVdwM3N6SUhzbXFmOHE3Ni1GRmJ1NWNEbWRoaGM1NE8zUTFCZTRnMDF6bGJyMm85emZKN25MV1lHbk1nUTh2VlR0Y2VhVWdRSWZhX2VhUkhQeDVLd1h2bllFRDhNbmYxSGNiWHhQakhIRDZQb2pLRWdnV1Rmc0RadVdIVHQxd01mZDhXY3FTaDZZ?oc=5",
        "source": "The Times of Israel"
      }
    ],
    "tech": [
      {
        "title": "Microsoft launches Surface Pro 12 and Surface Laptop 8 with Intel chips - The Verge",
        "url": "https://news.google.com/rss/articles/CBMiqAFBVV95cUxQaU02S3JwTHA0VjFGM3Jra3lhX2RGcVRhZWF4TENaZjJxV3pUWS1Sb24xVVY5Z29kYTR6cXpnWXBRQlAtYXN3Q0FVX1psLVRfazNCVHFQRzlNc1lJMV9YN2RJbmNpZEJGdE0xVDhvZFhRaFA5LVBPaXF2ZW8wSFhrdWdwZHV0V0dRMFRYWW84cTR0SWRYRFdLNFY4cmFXcnA2b0FVcUNTV3c?oc=5",
        "source": "The Verge"
      },
      {
        "title": "LG's UltraGear Is A Native 1,000Hz Full HD Gaming Monitor - Engadget",
        "url": "https://news.google.com/rss/articles/CBMiakFVX3lxTE4zT1RsQm9lU21OemVLV3NMcTBOMXpadkZFUUY0OGswUjNoM245VWRTMXczLVV1TlVENV9PWFRPbUU1SUxzTTBCYlRKZnA2czhxazVCdUM0RU5hczRyaUc0UFY5cWhzdVo1bmc?oc=5",
        "source": "Engadget"
      },
      {
        "title": "What We\u2019re Expecting at Google I/O 2026 - Gizmodo",
        "url": "https://news.google.com/rss/articles/CBMieEFVX3lxTE9BZFVNUWZYT1hoWHlJalkyLXNaTVFZZnY1YmFXN1BpRHZxUk02Q0JYOVV1MzNmWWJBWE1yeExxb2FBd3JJQUpfVWJNeFczMFJxaGNEdlJrWk5XRlBsT2J3dHd6T2RSbjA1bnVSS0h3Q2xqYmhlVElTaw?oc=5",
        "source": "Gizmodo"
      }
    ]
  },
  "guitarExercise": "15-minute exercise: E minor alternate-picking ladder (3 notes/string) at 92-112 BPM for 8 minutes, then 7 minutes of chord-tone targeting over Em9-A13 with strict muting.",
  "codingPrompt": "Principal-level problem: Design a deterministic multi-region workflow orchestration control plane for AI agents with replay-safe execution, exactly-once side effects, policy-gated approvals, tenant isolation, and cost-aware scheduling. Define architecture, invariants, consistency model, idempotency strategy, failure domains, SLOs, and migration approach.",
  "quote": {
    "text": "The secret of getting ahead is getting started.",
    "author": "Mark Twain"
  },
  "audio": {
    "src": "./brief-podcast.mp3",
    "maxMinutes": 6
  }
}
