{
  "date": "2026-04-11",
  "location": "Reno, NV",
  "weather": "Reno: cool spring morning with highs in the upper-50s F, light wind, and low rain chance through tonight.",
  "sections": {
    "local": [
      {
        "title": "Foxy Shazam: The Alpine - Reno Gazette Journal",
        "url": "https://news.google.com/rss/articles/CBMinwFBVV95cUxNZHdjeVBIbkRYbUktMFFac0E1SGxZU01EM0tOeENvX09SUnpJWm1XcUgtY2Y2Nl9CZUNZTG1GRVF2c0lLTzFITkR6QjYySDM1VnVsdjFUYTItSm12TW5OZnhLWGFiWW4xNjY0MWo0aU9na09SYTJJQjc2b0VWVzQ5QjMxaERZcnJGcFl2WmNCbmowM0tZSHZ1TkZNcFF6anc?oc=5",
        "source": "Reno Gazette Journal"
      },
      {
        "title": "3793 Herons Landing Dr, Reno, NV 89502 - Realtor.com",
        "url": "https://news.google.com/rss/articles/CBMikwFBVV95cUxQUWJSMFhXZ1lpaF9LdmJ5QXN2Mk1waDFVTTNORDNRVHlJT0p2ak03Y1RJQUZGSlg5UGNHelFPS2VWa1BMb2Jta2pNaXdXbmZCNldZdjlmT0hYNnBrLXBEZVBfNkktX0NsZlB3QnBlLUhRVDdnN1g3RTQ5MkxPVlFHUUR1MndRcDNxWFhSYkFFejVqMFk?oc=5",
        "source": "Realtor.com"
      },
      {
        "title": "Carson City legal - 60869 - Nevada Appeal",
        "url": "https://news.google.com/rss/articles/CBMiekFVX3lxTE1vQUxKWTlZZTl4LWZZVUdidTMtUlNmTzdtUGtfYUhkVlBWQjB3OUZWb0NEZkM5ZUhGdUVpenJGYkp2QUNIcEJtUVhsWFJSWHpvUVpSUUtJbHBhZnA3M3lnSjZZVklEMndmZmZ6bjlfRkdiblMxUXByT1NR?oc=5",
        "source": "Nevada Appeal"
      }
    ],
    "national": [
      {
        "title": "Allies yank support for Swalwell\u2019s California governor run after sexual assault allegations - AP News",
        "url": "https://news.google.com/rss/articles/CBMiswFBVV95cUxQMlYwclBsd2dkUjZuM3VtZUs4ZTN0WUFNUXp1b3U3WDJaQmFkaEpIUWNfVkpaRzBzbUFMWUYwZE5HeGlzYUpDNUk2Ym8wX01vVllINl9RVUhOU0V3c3paTzVxVHoxNktieEw1WkZVMDJqMlFRODJ6YTAyM0tLZ0tSM3J2b1JpYTRLZk9CR3lyVWZjM2JQdTZqcDRvSjJmYzVobXZtNHFWN0xFTFpxaEgzQmhGUQ?oc=5",
        "source": "AP News"
      },
      {
        "title": "Live Updates: U.S. official says no agreements have been made in Iran peace talks yet as shaky ceasefire holds - CBS News",
        "url": "https://news.google.com/rss/articles/CBMilwFBVV95cUxNM3BjbS0wbVNsakpHdDNKSDU3aGFWUFg4akhreGM0RVR4MHlneFlhM3kyWllUeWtnZXA2aERjRGZQZlluQlJBMHQ1ZnZGNE9BMER2Wmo2OV9tZW5NNHhHVmk0bHNoZTc5UWhLQlJnMGFxRlptQ0lQd2FEckV3SWhuYjlRZEJHWlQxWTczYnFkSjhGQnZlckMw0gGcAUFVX3lxTE9DVHRIbV92d1JUV1RLRU80S0hRYjREMkhnWkVmYUFub3BXRGwxb3lMdjhJdWxDZ0V6cHVrYnRENHpKWlAxYzdxMDVNZzN0Mk4tZUs3cFVfRW5LMC1OT0ktcE94T3RwaEszSGR0VHB0MlB4bW4yYk5kUk1pTUF5R2tiODFkX0I1cTRMYVc2UXZQQTUtRGhyWmpHTDdNeQ?oc=5",
        "source": "CBS News"
      },
      {
        "title": "RFK Jr. has turned corporate America\u2019s name to mud, POLITICO Poll finds - Politico",
        "url": "https://news.google.com/rss/articles/CBMilAFBVV95cUxPT05UTlNCclRFN1Z5Y2t0bDh6c3hOWHE2NjQxZmhjM2FzLUxaT0VwalJTb2ppcllmMW9LVUdSRzRDYldEWEpUYmFQQWh6OWxwQjlQZjJLdGtpc3pId29tXzBXZ2lMTlZUcUp3cHNLTzYzWXRZY3d3VHF0Y0NfMWFSNzdab0NJT1VUTmk3dzcxcTg2UXdl?oc=5",
        "source": "Politico"
      }
    ],
    "global": [
      {
        "title": "UK to hold off on deal ceding Chagos Islands amid US opposition - Al Jazeera",
        "url": "https://news.google.com/rss/articles/CBMipwFBVV95cUxOZVZobUk3dmlkelllRjZ1TWc0NWxvajR4MTBITHlDUnZFWjZzNktod1lJa0V4OTJlTnh3T1ItUEY4U2J6aXl5cy1BYzhMckg3TmFsZW9TRE12VzZVUV9KLUhpZXg5bmFGTFVuZGNYZkszelBTRUxYbUtSTVhkM05VUV9rcG5lN3NRTlhGQ3l2ZVFEZmxHNzBOWlhHNnI0T01kRnhVUXdYNNIBrAFBVV95cUxPU0pEejhzTS1EOTIxTkJPYWliUElTaHgxMUd6cU9meTJXck50MUxXRWpob0M4YTc5ODRUeWcwVng4TWRJTFp0Vlhqa0wySzU3bHBEbmIxUC1jem9kWHBFVmdseHVPR2pkdW9xd0Z1alBJbDJWV0xKZ2EtbWJyVHFTdTZWY3k1N1FNNzU3OGRMUmExY1NoRjdoaFlYUU53UENuQlBLTGQxenVVZjJH?oc=5",
        "source": "Al Jazeera"
      },
      {
        "title": "Lebanon and U.S. ask Israel for \"pause\" in fighting, sources say - Axios",
        "url": "https://news.google.com/rss/articles/CBMid0FVX3lxTFBvSXNnZGhOVXF2MU9fSi1LR0xPUjRwVV9RQnI3SXViX25ubTBWdk9yWXRsN1R2SjlCNndvLXNuOE56ZjNwOEJwZzBUZEZ1blhXNWJ1SjdnYTlfZFJmVl8wcTdnY0l6ZmlxNkUzMXZ4OWl3VEdDODlN?oc=5",
        "source": "Axios"
      },
      {
        "title": "An Orban loss in Hungary\u2019s election could be the turning point Putin fears - France 24",
        "url": "https://news.google.com/rss/articles/CBMiuAFBVV95cUxNZjgtM3FlM0dYcVV5UHlpem9GNk9KUjZDX3ljT28tV0RLamxiR05KdHhyR1ZfWnZwWHUxNlFqZUlTR1RSOU9BLWJEYjVDUktKQjFHRGRiRTlEa0NELVRZSG9hQ2h6REctckYxQ2hoNlQ2cWs1RkhFczJUMmxEbzRJSGRldXJHV05xVWdsVGhnMzQxYjkyNkhkWWp4aW5JOVItc1lmU0hYOE03RlBhb2M0VDZWaFZuNFRM?oc=5",
        "source": "France 24"
      }
    ],
    "tech": [
      {
        "title": "XChat, X\u2019s standalone messaging app, launching on iPhone and iPad next week - 9to5Mac",
        "url": "https://news.google.com/rss/articles/CBMipwFBVV95cUxOUEY5TEtNWVZ2Ni1OU1BXTmxsT245WEg5WGpRMXBRdDNMNUxTY0FXQ1F3ci1DcnNMMkVIUkVkYzJZaElOdm1QUjJEaU1uYWhvMzIzcF8tU2NMdmczUVVreDItYU1RNURCM3pkejk3VU5MeG5DSkRydlc0RHNWQk15ZDY3dHlfYkkyZTBhSkhVLXo3S0V2bkZCclh0M0MwTVJzM1N1SWEzVQ?oc=5",
        "source": "9to5Mac"
      },
      {
        "title": "Apple M5 MacBook Air: Is the 2026 Upgrade Worth It? - Geeky Gadgets",
        "url": "https://news.google.com/rss/articles/CBMiY0FVX3lxTE5DakFrOXJlTUxJTzE4X25RSzlvSjBSbXhmd2QweDBIckhTc0VlRUVUSE1zaWstU0JybGo5S09JUWI3d01faGJYWDFSOF91azlnT3dHUXg2b090Sk5sTWE0Tmx4NA?oc=5",
        "source": "Geeky Gadgets"
      },
      {
        "title": "NASA just shared jaw-dropping Artemis II wallpapers \u2014 here's how to set them on your Mac or Windows PC - Tom's Guide",
        "url": "https://news.google.com/rss/articles/CBMi0AFBVV95cUxNbEZxMzJ3UmRBYkdnTUFkb3dINFJ2TUw1M3EwWENwV01vQlYzaWFYdFNiNk1jUkp4MGwteG1ZSmNuVGE3QlFyZGRjclBieFpqQm4wM29XOHFjbG9JZzlqaVh0X3ZDQXY0MDcxbVlZMzRBV3pEZEVNb1Bkcmh6ZWF3YUgxVktTOFc0TWFPdkt5d0dWNXJJRWJGT2ExV3BQcGlRakQyVkdHV2w0SWlMT2Rwa0UtZ0p4ckVWVUlrbnhvYWREVVNfRXVfVVU5LTY5MG1j?oc=5",
        "source": "Tom's Guide"
      }
    ]
  },
  "guitarExercise": "10-minute fusion drill: in A Dorian, play 3NPS ascending sequences at 92 BPM with legato on string changes; accent every 5th note and finish with 2 improvised choruses over Am7\u2013D7.",
  "codingPrompt": "Principal prompt: Design a deterministic, multi-region incident command platform for AI agents that guarantees replayable decisions, policy-scoped approvals, and <2 minute regional failover. Provide architecture, invariants, data contracts, and migration plan.",
  "quote": {
    "text": "Discipline is choosing between what you want now and what you want most.",
    "author": "Abraham Lincoln"
  },
  "audio": {
    "src": "./brief-podcast.mp3",
    "maxMinutes": 6
  }
}
