{
  "date": "2026-04-25",
  "location": "Reno, NV",
  "weather": "Reno, NV: Cool morning near 42\u00b0F, high around 66\u00b0F, mostly sunny, light southwest wind, dry through evening.",
  "sections": {
    "local": [
      {
        "title": "Reno Pro Soccer begins demolition for new stadium project at former Jones West Ford site - KTVN",
        "url": "https://news.google.com/rss/articles/CBMigAJBVV95cUxNcVhFY09nZFZNanZCSmkwd2N2SVNraDczTjNZMEdSaWM4cTJZNWhySEVCaXQwTU1oQnh4ODlLODNzX0lxM1cyM0RDTlVYYUdlbnZHWFMwRnZoSjdFTlg5dVJiQ3lMSnVnVHVaeFFXWklHU2ttTEctQ0d2NUhYSV9YNzhfQmRqcEdabU5QWDNkVjN3M0xtaTc1T2VMUV90VG41NS1tU0Z5b29XZDdWTmdibnQ0SHhOVE02bnpLMUpnWFZfc2FWa0kxV3lvWEcwYnp1bWZ6aUVZUkJLSGhPa1g4YVRSMTh1eWNvbHA2bFlLWG9ZbjI4QTJNLThIMHRPMXNI?oc=5",
        "source": "KTVN"
      },
      {
        "title": "Demolition brings Reno Pro Soccer one step closer to construction of Nevada\u2019s first soccer specific stadium - KOLO | 8 News Now",
        "url": "https://news.google.com/rss/articles/CBMi3AFBVV95cUxORGNQdU96YVdtR0ppSGZuQWVUVVlPNjhTRk9FT25IS05kM3A3SUY4SkxCSTZCbE9tcHlfaU1qT25hMmcxR0JhVTNmblFLbkJ4eXl5VTBHZ2V2NjRrZ0hpRkNSX1RsYm1USzdaLURBMnZQRmlfSzM2RjRsOWstX2xYaU1PU1lpZ2JKdEdzRDlkU21EMlUySWhzVFNvNTN3azdmTkZGdkktNFhsZGVJSkkweXFfQWx0MC1qWGVrWTFxc1BMNkZ2WW8zcFkta3ZFZUdGYURjS3h0NjBlU0VX0gHwAUFVX3lxTE1HRVc3MUFsbVNMeDlaVlNlaUhFdjJvQ2JuUVZoSFpGMlJjcFg5ZlIzTzBnSXp0YW4wa1NoUy1FRjBzdWtyTVpuVEx3blZTOWhKY1d1T0NhN2xoMHFXTUcxaTh4ZlB6LVYzNXZUbGhiV1l1cFFNM2ZnQ2hidmFyOG03WDJzLUJRS05Qa0Znc1JIeUttaEh3aDlMbHdOWVNaT08yMTdTXy1UMm1aOVAwUmR0aFFVQXhDNUxCd3RVV3JmUXZ2ODFzVW5YM2dUM2cxZ05WUWxlNlpqcVlELTk2RzdQUEZBNE9ZNjB4emRKOE1lOA?oc=5",
        "source": "KOLO | 8 News Now"
      },
      {
        "title": "Video: Northern Nevada Public Health unveils new state of the art tuberculosis clinic - This Is Reno",
        "url": "https://news.google.com/rss/articles/CBMibEFVX3lxTE1GRXVWQnpnMnVpNzhwSEl4RXBIVGtub2RiejFnY1NEM2gxMW9NbmVySlpOSk5HREhSVTlSX2hZa0ZWQ0d2M0ppRFNSSGIyd1Vjam1MRFlYMjB1dGdqNENFMElrZTl1d3FzclhQSg?oc=5",
        "source": "This Is Reno"
      }
    ],
    "national": [
      {
        "title": "Tornado roars through Enid, Oklahoma, destroys homes, forces Air Force base to close - CBS News",
        "url": "https://news.google.com/rss/articles/CBMieEFVX3lxTE9yMmdha3B6Qm9lYUQ3eXhfdm55dlh5akdJbGpyVHRwOEhhUHBQLUF5dmlLNFFzZHR5OFBHNVY5V3BkTk5COVNCREtXMDhoX21SbDZ1Szh0bFlOTGszdU1wZGtIck9yQjNINlM5bDRFQ0g2S0NpQ19fNNIBfkFVX3lxTE1vOXJfTW5xdTI5a1FJODRmSmJzaWN2MVpDVDB5YUZEQ0ItQmtVcW9QMHpOTThkam5CNl90NlBmemNIcmY0U0tzTWFFbnJvSFNkd2xYQTBoUDVjUkxCbEFJTkh2bGs1OTJnQXpjYVg4bTZXdF9oc3g2Rmw3b2lVUQ?oc=5",
        "source": "CBS News"
      },
      {
        "title": "Live updates: Top Iran diplomat set to travel to Pakistan for talks on ceasefire with US - AP News",
        "url": "https://news.google.com/rss/articles/CBMiZ0FVX3lxTFBUS3ctMW42dXY5MUNfclRCUWU1Ty1KLU9lQ282ZUU1VGN4M2NsMS0zdWloYkJLU0Y4TDRJTFhKZThDMjNjbzJEQUtFem9VZW1oQzRfM2dXT1VMQVYxX1V0ZGR0bEY4LTQ?oc=5",
        "source": "AP News"
      },
      {
        "title": "India voices anger after Trump shares comments calling it a \u2018hellhole\u2019 - The Guardian",
        "url": "https://news.google.com/rss/articles/CBMie0FVX3lxTE9wbzc1bkVPaUdoYkRKdkxEb3ZZekhhZzEzN0czMXlFdE0tblBZY0QzaHExdnd0SVdGX0dNVWpHNUxhWWNhMTV1T1NHU3lhSVRKTVk0Qlc3bGRTdVVQdEFTUjhsX3VyYVUyeU9LMXhoN3VfdHlocU04bTFqcw?oc=5",
        "source": "The Guardian"
      }
    ],
    "global": [
      {
        "title": "S\u00e1nchez dismisses US notion of suspending Spain from NATO - politico.eu",
        "url": "https://news.google.com/rss/articles/CBMijwFBVV95cUxOX2xFS3FLUml2bTJyR2VXVTctblMwbkdFR2tsVUtscTZNaFFDM1N1UmduV0x5NFNSWEQzUmNtTzFicTk0c1d3UXR5d2g4dlZWZmRTV0RlbE91MFoyZFlfcHQ2SldaZkZiZlhEN3RlNDBSM3ROblFNVHZtTFZkbFg0MnIzcXJHR0IzYUN0RkZycw?oc=5",
        "source": "politico.eu"
      },
      {
        "title": "Israel's Benjamin Netanyahu treated for early-stage prostate cancer - BBC",
        "url": "https://news.google.com/rss/articles/CBMiWkFVX3lxTE04dWFnTjMtV3ZMaTg5dndWZlZFbVJOMUh1XzYxbWh3X2dDUEtBTGNGRjhTOTNGYUhfZDNCUHJaM2ZWNk1iZDZJVDVSRTJLUzB3Zmhka1dXSlRVdw?oc=5",
        "source": "BBC"
      },
      {
        "title": "Gaza Set to Hold First Local Election in Two Decades - The New York Times",
        "url": "https://news.google.com/rss/articles/CBMijgFBVV95cUxOR0lkNk5ybmE1dmJsVzlsSnlrUHplWXV5QklDQlVPYlF0cXZZajZyRmE1WXNFLTQ3Z0hvTzNuRnI0MDZ3TVFUaEplVUU5blZJVUczaXhyMGlhdXNrRkNMMU41ZEZQa21kY0QtMlJuakllUFl3S3p1MmxqcUtZXzRqT3dqRXB4V3BPaFg1TFBR?oc=5",
        "source": "The New York Times"
      }
    ],
    "tech": [
      {
        "title": "YouTube TV starts rolling out Multiview upgrade that supports any channel - 9to5Google",
        "url": "https://news.google.com/rss/articles/CBMirAFBVV95cUxQaXhhYlpNS3JVV1BvNDE1ZGdhYklWcTB5TVpvdmhDU2RRcV9hVTZXUU40S0FLLTZzUV90UWNSUnZuMXExeXpvVWNaYXpkdXFnemlrWEpfWnpqWTdJUExLOWhvMU9aaEJEd1dZLXNMcjRkLUYtYlI4VnRuWW80ZDFiOUdhYk5RN0dSM2V6ZFlWdFpIN2VGWm9jWFVGMUFQdVN2MUx5WFl0LVgybmVu?oc=5",
        "source": "9to5Google"
      },
      {
        "title": "Claude can now connect to lifestyle apps like Spotify, Instacart and AllTrails - Engadget",
        "url": "https://news.google.com/rss/articles/CBMivAFBVV95cUxPaGNoTXNQQUpHWk45U0xhWnlCNGdDTUhGeHFjTmhVcWdzV25aNjMtVDJpQ0ZhSWozaUR6ZXd0MGM2Rjh1MFBQbnVHYmJqc1RPbmhUcWg2cjcyclN0aW9mVC15cjJzYzVramdmaFNIYXY1VDI0dGJ6cWRIbEIwMTFmRHgzemppUV9Ubzd1dGRvd1lVZmtxeWdaT2JlNFhYMU5TM2U2cmhpTkJmWkZ0MGRlMEMwdk8yekdiMXpNdw?oc=5",
        "source": "Engadget"
      },
      {
        "title": "Microsoft Gaming reverts to Xbox branding as part of new mission statement - GamesIndustry.biz",
        "url": "https://news.google.com/rss/articles/CBMie0FVX3lxTE5QQ05ERURxdFJhaFA2ZmxLZlhyd2hzRXhXNG95cVBlSUlfWGI2M2EzRE1CeEU4WnZDczQ1cWUxRl9wbHdFdzYzMUFhS3VCVHNRM0FXSVdKZG45Z3lPaDk3YWVlNmloWmVGRUF5cEk5dHgtVVVHWjAtQ3FWcw?oc=5",
        "source": "GamesIndustry.biz"
      }
    ]
  },
  "guitarExercise": "15-minute major-scale sequence workout in G: 5 min strict alternate picking (80\u2192110 BPM), 5 min position shifts across 3NPS shapes, 5 min phrase application over I\u2013V\u2013vi\u2013IV backing track.",
  "codingPrompt": "Design a principal-level deterministic event pipeline for compliance-critical fintech payouts: define idempotency keys, exactly-once semantics over at-least-once transport, replay tooling, audit trails, and multi-region disaster recovery with clear trade-offs.",
  "quote": {
    "text": "We are what we repeatedly do. Excellence, then, is not an act, but a habit.",
    "author": "Will Durant"
  },
  "audio": {
    "src": "./brief-podcast.mp3",
    "maxMinutes": 6
  }
}
