{
  "date": "2026-04-26",
  "location": "Reno, NV",
  "weather": "Reno, NV: Sunny; temp +64\u00b0F; humidity 39%; wind \u21934mph",
  "sections": {
    "local": [
      {
        "title": "OPINION: Reno finally considers actually doing something about data centers - The Nevada Independent",
        "url": "https://news.google.com/rss/articles/CBMitwFBVV95cUxOR09VQk43ZDN3YXEzRVRVam1YZUJaeF96dXdNd28xWmtEYXBST2J1R1V6c3c0M1UyQmNSaGlRcTRYTUotYXhxMnh1bmRUVVhUSjFIaW1tSzVmWHZDZ3M4MWNxQ01NYjg2UEdKcGlwWWZ4Nkswa0xVZEtsS3R1UWM3eUtzMVJ4R1lZMVBzYUx1OHl5WlpjX2dnb09ESHVTWS1lVkpES2F6RGZMQVhFcDgwbWlnNkNTQjA?oc=5",
        "source": "The Nevada Independent"
      },
      {
        "title": "Scattered showers in store for Reno, Lake Tahoe on Sunday - mynews4.com",
        "url": "https://news.google.com/rss/articles/CBMikAFBVV95cUxQaFdDM3dRWWFpWWZ0VGpaY3NtbHJ1NmRHVHkwQ2lhNmgxbFFRUl9xWUp0MFRhVWdZUUNjeVpDdDFheC1lNHExbjZnSFAxTGtZYWNYd3BzY3FDbmhZbzlncEZTczFYN0NWdkpqY2hJTTR3Qm91RkFjODVpREx6MlNHb0tWU3hVT0JuSmFIYmpMT0c?oc=5",
        "source": "mynews4.com"
      },
      {
        "title": "Train derailment near Reno sends more than 20 railcars off tracks - MSN",
        "url": "https://news.google.com/rss/articles/CBMipANBVV95cUxQaFNwdkdsbXlXVndXWi14dzFiSGFMTVZ0ODlaOVVLbTRmWFFpakkxMmdPelFJY3JpZUZXOEFTbVctRmxyS2RhTWxXWHhPLV9MdDB2VTBOV3NhWEwwTjBuVjFsdHVleDhRZXNham1LYVg5R3l3Qm5FektBMWpWRWhpY3dWNEdQeFczLVktcHdUZ3g1U3o0YVk4bkJZU1B2VHEzSlhQdWE5UVktZkZDakVDMkFaaGFIRmhjZVFDUVgxSGkyQmJhOVllQ2NnTi1DQ0hWa3h2bHNORGRzU0dzY2E5eTRvZ1NEVUtzTXdPdENjYU02XzltOGx4blE1MXA2NHBKOUZBeF9LakNFTXcwaXhBcmFDUWdHdk9DVFprblY2VGNUMVpfVm14akRNSHVrQnBYaW04MXdsekN0clNXaXRhdWJNUVFEQ1V0UU55RGpLaTJJTEhTd3ZSNDE4RnBZaW1kZmZHaXlWMnVKcWtsYUxZUUF4VkxrZXlYYUlBRUF4WXB4NlprdWJMYlVKbTFFNGl2NkxpOTZBRWdsWnplTmJsaUNBMDM?oc=5",
        "source": "MSN"
      }
    ],
    "national": [
      {
        "title": "What we know about the suspect in shooting at White House Correspondents' Dinner - CBS News",
        "url": "https://news.google.com/rss/articles/CBMilgFBVV95cUxPR2NBc1QxbklmeFRsbkdMdmFtVlpnRmR0UEhwV0QtQkhSOTNNU2VHY3Bld0Y5WXM3eWxFdllraklJWlQ0TF9HaUhKbzQ4WXhyTER1cVR3dnVaa3huUWtlX0NNdXh1S3VNYV9XZ1hTS0pXQTg3MjE3V01VVmFkSGlZTG12V0JqeWJNZERfUHVzVk1GdDE2bXfSAZsBQVVfeXFMUEdhMXVINVo0VmZoOWtXVU5ESXgwd1N6MFBGZEFyc01LSkIwQVM5WGE4TWx5WkVhY3IyZ0ktQlBDS2M5Zi1ZTnBOYkxIcHoyMzc5eDZqdnZGT1dSRlZnZ1pxbHpLMnJ5YVVSMWtnekVuR21CbTJNWDZOdlM3aGhkRjVmMmtSWE5XZVJNNjVpa3lpWnJQeHc3MThTcjA?oc=5",
        "source": "CBS News"
      },
      {
        "title": "Islamabad Reopens After U.S.-Iran Talks Fail to Materialize - The New York Times",
        "url": "https://news.google.com/rss/articles/CBMif0FVX3lxTFBfTUV3OWVlNjd2NXBPN2ZBSVpsNnZoUFlpMnowdzdZUnZPMENUVHY4U2NZTkdrNDNHRUpQMnJkR05yUVdMSmt4VXFjZEFmYVJ3b0RtWEtOTDdEZzJBLTE2alR3SFYwNVRIOXNPT2FrVUI2blZSR3FLN0hacHg1Zkk?oc=5",
        "source": "The New York Times"
      },
      {
        "title": "1 police officer killed, another wounded, in shooting at Chicago hospital, officials say - ABC7 Los Angeles",
        "url": "https://news.google.com/rss/articles/CBMipgFBVV95cUxQYjluTnEzdDY2bUlNNExiYnBXdVNZcW1JSWM2cWVkc2JpSmJjRFZhdGtXS1VtQXFhWGUweDFIYWNhYVE1X1NxX2c5UHdhcG91R08xeUp6cmNqQ0toQnlHZVUxdEJKVGxaNHk2YXo2eG5IUE5rZkI1Nkp5c0lHN25qREtlR3dEZEhhUzF4aThiMEZOcDRiTzZ0bmVXQ1c1TmZVWWI0b2xn?oc=5",
        "source": "ABC7 Los Angeles"
      }
    ],
    "global": [
      {
        "title": "Despite Russia\u2019s war, one Ukrainian city still gathers for midnight Chernobyl vigil - AP News",
        "url": "https://news.google.com/rss/articles/CBMirwFBVV95cUxObVV5b1RHT0xKWFpnRUZlN21udHlIZHdXdExYdmt6bl9fSmRKeWtWWl92VkxHQ1hZQm1pRWtidUJNWFBxZk9UNFpfNWVnRVJHV1gyN0N0V1YwU0ktcERsN2JibkFXWEdxR0lfTFB1UVRtaWRyemtnMkx3YVpWVDdnT3dmUXp6ckhzQXpiY2JCeXlBdl9JT1VJSVBfU3B5T01iRG5sQk55TlR3Vmw5RDgw?oc=5",
        "source": "AP News"
      },
      {
        "title": "Mali\u2019s Defence Minister Sadio Camara killed amid coordinated attacks - Al Jazeera",
        "url": "https://news.google.com/rss/articles/CBMirAFBVV95cUxNM0xhMGVDN1g3NHZnTy1nTG45NFdsNVZvbWtKal9UNVBEOENCTHVWaVJHREUxSDMwazlZdGFCUXAzRXZKXzdta1psMkRnTXhZdGxMbkoyVHJHd0RDWjZQdTB4SUVoMEVfajlUbnBqNUlRYWllUV9tNldPOXJubnY3aWVVSUFWOGFRV3lRTGFpdVZCZEtfc2xMeFBkYmpvVTYzWFJfbHhkSW12cU1y0gGyAUFVX3lxTE5IY0FCWm42Q0JyTGp4aDZFSHhTS2lnYUZOMUlwZG52WkI3eHIyeXUyM3BGVVRnQTlEWmk3bDhuN3V6X0FFZnhoRWIybHM2elBtUnZQZHhFUExuWnFEMVowRE1uVmlCTEQ3M2tsXzgtLWNuSEJKSVYtYzBwTzRaMnBOYWE5MDVUQmFMNFo5bl9rSHBCeG9ibV9WdHVnRGJ3X3NzOW1UbVFRZklkYzNxMUZJMHc?oc=5",
        "source": "Al Jazeera"
      },
      {
        "title": "Police in Northern Ireland declare security alert after reports of a car bomb explosion - AP News",
        "url": "https://news.google.com/rss/articles/CBMinAFBVV95cUxOTlRoa2xDTVRWMnZkQVZBdk9sV1BRSXZYNWFkYUpiOWVuYnVfWTlGel96QlE4OEltUVJQdWpRQmtJVk9uSUZUZE1fYU1rSUlZd2tXQ3FpRkpsM25FWlIwbmV1azQtNmFnT3BwNGo5eEpXX2lNNVkzRGNKN0dLNUNoanJaQzJRVVZYdE1xam9IWjhmVHJfbjhKeTY4RVA?oc=5",
        "source": "AP News"
      }
    ],
    "tech": [
      {
        "title": "Microsoft rolls out revamped Windows Insider Program - BleepingComputer",
        "url": "https://news.google.com/rss/articles/CBMiowFBVV95cUxQdWR3RlY0RHdqLTRoZld0WGFGQ25hOXNFMUloZ1pQZ1REa0JvZ01QUXJoNnVsOWswYnVpLU50ZlN2eXpxODF6ZkYtVWg3LXlkZEZINC14aW9ZQThoall5ckFyRzY5enp3LVJHd1dxSWRjUjFYRmNTMDQwWFRTVlBNdEl2VldHS1JCcmM3QzFObTdLQmZFV1RrQVVhYmZLVXRycnZN0gGoAUFVX3lxTE53NDg3Mjc5aThwTm5JSXhBWndDZlRDblFyZ2ZfejlDTlAwalpnN3Vob21OUFBYUVlKa1lSbE5ERUh3dWNJbllmUlJ0NVNIcEd3bjNZM3pWelVyX1VLdEZGQ3dGeThZQ3dlaFNsNmVXZ2pSMkJKNmVQRXo2OTRJSFBvNkUwVkxERl81bzYtX1NnVTlGN21FamxsYmVTSEFkQnBjWjhBZHFkaA?oc=5",
        "source": "BleepingComputer"
      },
      {
        "title": "Foldable iPhone Ultra confidential docs leak: 9.2mm design, Android-style selfie cameras, color options - Notebookcheck",
        "url": "https://news.google.com/rss/articles/CBMi3gFBVV95cUxPZ2EzMkJnZVZoNlI0WGx2QUNCQ1Q5VktwdmZhd09tLWR3MGZzdGMwWjVWNUxLRDY4R1JMbEI1eTlhN05FLVBtSXA2ZDJKRThuRDNvcnRRcHBLdjYzX0M3ZkZxME0ydTQySDhqVlMxbkdWcGlhbm92WG1zTXp4YWZMWTBDT25JcmdZeVlKeHlhSDEzam5GUzhzVVNyMVVTanJRYUE5bE1JWFN0VWZaMWsxQVh0NGpiOU5lZjl3N1lFNm1PR1VlWWU5LS03T0xPRXp6OGVyQjRUOEhQakpEMGc?oc=5",
        "source": "Notebookcheck"
      },
      {
        "title": "\u2018Shutdown, Restart\u2019\u2014Microsoft Changes Windows To Ease PC Users\u2019 Frustrations - Forbes",
        "url": "https://news.google.com/rss/articles/CBMisAFBVV95cUxOczBvOGZ4SEkwZmJmM1FFUG8yLVJwMkMyX3ZZa01odGFrNlVJUXFWLUpoelJpRlBxdnhTUzMwNTMwbWVia3Bxb1V2Z3BQNlBjMUNhYUZwY0FpVkN6aTlUQ0ptR0FIOTdSbGdRd1Z1N0E4cVk5azVtLXFGdGI5MGZucmdHTVQydFgxTFY4MnF5c29UcXlUbWNMYkx6RkMwS2o5MGd5UzVXamFueE1wQmExUw?oc=5",
        "source": "Forbes"
      }
    ]
  },
  "guitarExercise": "15-minute fusion precision drill in E Dorian: 5 minutes 3NPS alternate picking at 90\u2192110 BPM, 5 minutes hybrid-picked chord-tone targeting over Em9\u2013A13, 5 minutes motif development with rhythmic displacement and strict muting.",
  "codingPrompt": "Design a principal-level deterministic multi-region workflow control plane for AI agents with replay-safe execution, policy-gated approvals, tenant isolation, and budget guardrails. Specify architecture, consistency model, failure domains, SLOs, and zero-downtime migration strategy.",
  "quote": {
    "text": "Success is the sum of small efforts, repeated day in and day out.",
    "author": "Robert Collier"
  },
  "audio": {
    "src": "./brief-podcast.mp3",
    "maxMinutes": 6
  }
}
