{
  "date": "2026-04-12",
  "location": "Reno, NV",
  "weather": "reno: \u2601\ufe0f   +53\u00b0F 37% \u21933mph",
  "sections": {
    "local": [
      {
        "title": "Jeff Rosenstock - Reno Gazette Journal",
        "url": "https://news.google.com/rss/articles/CBMikwFBVV95cUxOVGZjYkxvZHRBdjBmMm9yWTBnOXF1WVpsWU0tM0RjVENVZzFjMlpzVHZOVVJPY2xrRUxWVThjVGphV2ctREwxSURfS1JDeEVJQ2g3cUJvWjRRSTlXSXJjemcxVE55WnozRFVxS05SOFFWZkhmUmNfSzNIcGhHM0FOLV9oTTItdjQ4Y3E0R2M1OWVaLVk?oc=5",
        "source": "Reno Gazette Journal"
      },
      {
        "title": "Reno, Nevada in the United States Explodes with April Festival Fever, Unmissable Events, Music Magic and Spring Travel Buzz - Travel And Tour World",
        "url": "https://news.google.com/rss/articles/CBMi_gFBVV95cUxQc3dLQjc2MzlBM2ZTTXk5RG9FOHlQWHFKWEl4QndXS2NUVWNFOFpKZkVPMjhWSkZ3RHNfRWFtYzJxa1FyaTBTaTlyY28td05tV1lpNlZZbHRNeEw1T0NadkE1MUpJWFNUMi1yWDNjMGw0LTlYUDdRM3pZbDJoZ29qbVhQek5EUGpNWlA0SV9ubkhQcEJOT1JNVndJRXkzUXBZNWRNYlVGUFVyODFidHNlTlJTZ1UzdFN2eWlwVkJqU1p0UHFMNEJCU2wzSG13anIwSFpwb1NUSU9ST2NCQ2hKOW4xcUlVekM0SWsyc0Vxb1d3dk15UVdSRHBsckFfUQ?oc=5",
        "source": "Travel And Tour World"
      },
      {
        "title": "Probable Pitchers - MLB.com",
        "url": "https://news.google.com/rss/articles/CBMickFVX3lxTFBJQXhQRFBPZXJ5TG84VGJXY0FubWRCcWRSRDRiM3BaZzczQkVtXzFIdDUzM1BydlF6QkFXdzVnOWUxUW5QWGF2YU5aMzRjV3hPb21GM191M3A2SFBQajM5LW84X3ZxVmpDQzBkUE5BQzc3UQ?oc=5",
        "source": "MLB.com"
      }
    ],
    "national": [
      {
        "title": "Control of the Strait of Hormuz and Iran\u2019s Uranium Stockpiles Were Sticking Points - The New York Times",
        "url": "https://news.google.com/rss/articles/CBMisgFBVV95cUxQWFBFR0RDUVE5ZjF3b2lNY1BLbkF1X1ZFYjk2bktLVE5UZzJ1bHBRNEJNT3FJcndrMFBaR0hRX1FZYkFrY0Q2TzZsZmVHcjFOTE9SS09UWXlhSEVxaVk5Y21YNmx3czRpNWNyZy0yQmlhY2x3TFBFOWw3SkVUd0hVcC1wRVFjcFlvYlZBc243bWhrNl9tR1Nuc2tJcEs5VWo0RVRWZ2RfX3JKTzRDakt0cl9B?oc=5",
        "source": "The New York Times"
      },
      {
        "title": "Defiant Eric Swalwell digs in as DA opens investigation and staffers \u2018stand\u2019 with accusers - San Francisco Chronicle",
        "url": "https://news.google.com/rss/articles/CBMihwFBVV95cUxNY016N3l3cnQxd1B6UXVQRWhOTlZCNWJTMFNqWHFmS1FRenpka01PZVNiUnJaMWZYNWhBbTFjT1FlRm9sVVVhSkIwTWlEWUN6WlR0Y1RTUzVmQnRLZlVjX2dRNmtVRGgwZjJ1OEZvS3pCWjJEbzhkVllNNWJ0LUI5WmY4em00alE?oc=5",
        "source": "San Francisco Chronicle"
      },
      {
        "title": "Trump says U.S. will blockade Strait of Hormuz after Iran peace talks fail - CNBC",
        "url": "https://news.google.com/rss/articles/CBMid0FVX3lxTE9PbTY2UnlVRmhDNk1JLXJBYTlzUFBPVXZ0VDR5b3htTnpwTGM2bklzdjJZTkNBTGNHUHQ5RE5YNjl6NF9mWl83WVlOU0VqU1Y1SlJBMksxTU12ZFhkR2M2MTRJcVd2cDVVSGxBU196NU82YnVMLUpr0gF8QVVfeXFMT3lmemY2VlRadjc0WlRlemNuQ3pHNWlPMzFyMWZDMEtqUE5odEtNYWxTaWNRNUZQNXZKVXdMVU13Yk53WDZySUZOb1laVkhiVUlmeGtrTDJGeWd3c0o4ZWtJOE1oZFlzbGRMVDFmYjdab0xpMENXaVpWT29zZw?oc=5",
        "source": "CNBC"
      }
    ],
    "global": [
      {
        "title": "Hungary election: Orban faces tight race in pivotal vote - dw.com",
        "url": "https://news.google.com/rss/articles/CBMilgFBVV95cUxOQjZXamlCTmV2T2tUOXRqUmVtSXhCOFcyQl9HUld6LXR0c1JXdTZENFdubVpTVEVPT09RSHN3LTlCYTNPNHV3RWpCT05MVERBN1J4bU9tTXBvb09wX2VzMWNRaFVEVWEzUTdTWVM5QnZ4TDV3dFEzVUJpWjUxdDgtRGIwOHUyZnpiVjgxZnZpcndNRTdPc1E?oc=5",
        "source": "dw.com"
      },
      {
        "title": "A Hezbollah commander describes battling Israel in Lebanon - NPR",
        "url": "https://news.google.com/rss/articles/CBMigwFBVV95cUxOcHVCY0RTVXF3bnVpSWdzMVNOY2lray1wSTMwVzd2SlA2dEdKZ2ptLTRtMjY0NXl3RklrZ2pEeHVBem02czNpY1FQNzZCeFlGaUcxUnJ1ZWNSZzFlZTBMUGZieE1pLU9TcnV4TDVvRzItYS1aVXdlOFZmMV96UjI4bnY1bw?oc=5",
        "source": "NPR"
      },
      {
        "title": "Pope Leo XIV denounces the \u2018delusion of omnipotence\u2019 he says fuels the US-Israeli war in Iran - Politico",
        "url": "https://news.google.com/rss/articles/CBMi2AFBVV95cUxORl9GVVlLVDNXdEtiMVhDcENva1lLeUFMVVdiM0Q5Rm0xWGZaYy14QjZESHpmOGEzcnEzUm9uWnlGV29Hb04wXzh1QTNpakZfSDBlMEZZaGp0dEdsVldZUW1Ic0p1ZkRxT3V2UkV0bTB1cjE4WWpCX1YwcEJBc052ZGdYMkJlcmhxWG5fSVJWTUJKcHRSektRT2s4d3luUVhiamdMU3N1SkJFcnFBMnZJM252aWJPV1k2aTdmUEFRZmVXRnpYdWhxSGhIZGRJT2ZWZURIUG1FOVM?oc=5",
        "source": "Politico"
      }
    ],
    "tech": [
      {
        "title": "Engadget review recap: ASUS ZenBook A16, AirPods Max 2, Sonos Play and LG Sound Suite - Engadget",
        "url": "https://news.google.com/rss/articles/CBMivwFBVV95cUxPOW1KNEp6NmtiRXEyNy1PaEl2dHNURTh1ZDNnd2ZQYzFSa2t1ZGVKcEktUUVtZnlRMXQtN3NFdWVWUDhLVXJzT195eVc3bWZXTWRBaVEtc0JVUmJuSGtRTThnYlJ4Mkp1WnFseFJGM1oxQnZHRnhzUXQ4OC1CYlBwZ2VJdHBjTHowSldWcjUwcWVseC12VW9WRFlnNjhaRGhzLUZkWG9xWmJacWdlNW5adHNIenh4WXFnalFGZzZOcw?oc=5",
        "source": "Engadget"
      },
      {
        "title": "Framework CEO warns AI boom may lead to a scenario where \"personal computing as we know it is dead - Notebookcheck",
        "url": "https://news.google.com/rss/articles/CBMi2gFBVV95cUxNbWRkc3RVRzJ1UXM1VW5Pb1NpVG1BRjJVZVN6MGVNNk5RWFYzbWg3dHRFQVlTOXVtQ1ZUT3lTN3R5aFk3WWJnbFVtNmhNcHNnWlAwWGUxMnJTaFMwcUM4d3dYSFBMSzZmb01RTWhvWFV0aGlkVW54WjFFT05ZSHdhZ2ZkbUlSYkxCSC1HcHU3RW5kMXNfWWtod1BTS01vUEc5SzFWdmZDbXFIdXhKZ0RELVRxcndJN3RieTZMUXhLZUs3blA3dEtqOGh6TFZLOVhYTWJ3aEFoZWl6Zw?oc=5",
        "source": "Notebookcheck"
      },
      {
        "title": "Google Messages for Android rolls out Trash folder - 9to5Google",
        "url": "https://news.google.com/rss/articles/CBMid0FVX3lxTE55Qk5ORmh3MlU4dlprMTh1ek9ENnlHWlhNNXpsbVRjU0pEQ09nc2NfaXh0Q1lLTV92RlpIbzR2cjJmSlNDQnl6dTJNMUI2QTc2MlBiZ1pUc3g5VnVFbnNvVkZSd3lvVWJUUkpLYUtudGY5T0luRHBv?oc=5",
        "source": "9to5Google"
      }
    ]
  },
  "guitarExercise": "15-minute modern-fusion drill: over Dm9\u2013G13\u2013Cmaj9, play one 3-note-per-string shape and displace accents every 3 notes to force odd-group phrasing.",
  "codingPrompt": "Design a multi-region feature-flag platform with monotonic rollout semantics, blast-radius controls, and sub-100ms rule evaluation at edge PoPs.",
  "quote": {
    "text": "Success is the sum of small efforts, repeated day in and day out.",
    "author": "Robert Collier"
  },
  "audio": {
    "src": "./brief-podcast.mp3",
    "maxMinutes": 6
  }
}
