{
  "date": "2026-04-19",
  "location": "Reno, NV",
  "weather": "Reno, NV: Partly cloudy, high near 55\u00b0F, low around 40\u00b0F, winds around 11 mph.",
  "sections": {
    "local": [
      {
        "title": "Dry, warm conditions round out the weekend in northern Nevada, Lake Tahoe - KRXI",
        "url": "https://news.google.com/rss/articles/CBMipAFBVV95cUxOWHNfSnI0SXI2ZGcwVE56Y1kzUU0zMUlmd0NfeGRObWE4TDRJd25mcVZIeHU4VG95a2VQTGh5aG1WWVIxYUNKV3dveHd0clBrVlRFdGtGbTA4dXN2U3JwZHp5Q3N6NUNRVE5UYk4wMm9DdHFjT2VEWTBnc2M2VlB4QlNsLXNQbUVlRWFrcDV6OVJPTlJrTWhRcHY0am9KbkhTTmRoZg?oc=5",
        "source": "Google News"
      },
      {
        "title": "Nevada golf course reopens, second nine to open soon - MSN",
        "url": "https://news.google.com/rss/articles/CBMihwNBVV95cUxQajJoSGlEdDNidG9XZDNtbHY5aURHYWJBc1BzTHBqYXIwc3V5MHJ3OVFNVnZDanlEa0UyakV2dGRra0dveGN6a0VXdG4tWWp0RTBCOExka0ZCel8wUGV3a09GSGFtbmVwcHdrM3NhbjhNNlNvbzFEN1J6WWllaC14dzVJT0FUUUlUeXRiOG8wREV2VFpjOFRwUUg2LV84cWdiUmI1YkExZS1iRDlqS1JlWV80ejJaeVY5NEhLaUQyNG1rQlNSTlBjUGtqdjJwdWx2alc1UU1wQXZFTmJhLThGdVVEX1lxNTJjTXVCbnFRMUN3SW5qVWI4OXRDMk93b3NTcjlRUVpHSzQyV0xzd3NjX1FkdUduM0lsdkZXX1VMUkQ1Tk0yY1hXc0pfQ29aSXVEMTQ3Y09kSTVtd2xtdnR0My12cDRWaUwtR1JQT0JlaDFZdVlMbjU1Q3p1VVpoUUtnbDVTVVNwU05FZEJoX1NZYllicmlQRUZPLWlpdENENGNoMkp0aVhn?oc=5",
        "source": "Google News"
      },
      {
        "title": "Free community health event was held in Reno - 2news.com",
        "url": "https://news.google.com/rss/articles/CBMiwwFBVV95cUxPTlQ4Y0cwdmVkWmRPdTU4bVNXTkpaVjBTUHNycXB0OFo3YkJjYzV2ZV9uNU54cDM2OEhfS2xCNllWUXJDbXVJV3dNNlpGaFkzTDdZdUpoSkhQRzZqUTBnZnRLckJTazJER210SDBNMGQzbHhNanRBU3FhMXMyMm0zNWNiSzJXRm45QktwanA5QjRBWF9kSDE4VDl1a1E4UGcweG5CeXVlekJIdjFzQzJkdmtKZFJ2bVZROTJJWk5BX0p5dnM?oc=5",
        "source": "Google News"
      }
    ],
    "national": [
      {
        "title": "Iran doubles down on closing Strait of Hormuz as ceasefire nears expiration - Politico",
        "url": "https://news.google.com/rss/articles/CBMiwwFBVV95cUxOaHhnSWdoNmM1LVo0NzRtR19oLUlsVnM3V19scDFyRTR6MXlTWDVYcVlON0Z3cE5HcU5QdFpfYUUzSURPSWtFRG1VaHRKbTl2MVdTZWtFTWJ6ekQ2QU1ZcXQ1My1xd3lTTjQ4a2hPeExuRmVuR3pncXY5VnR6ZjJhaUJWUjU1YnV4SnBFYWN2eG81U1B0d25GQS1Ldi1taFZMQUVsWmc2YkxqSkJvY08ydjhCN25VYTlMS2F2M0Q5WTFudG8?oc=5",
        "source": "Google News"
      },
      {
        "title": "Scoop: Trump convenes Iran situation room meeting amid renewed Hormuz crisis - Axios",
        "url": "https://news.google.com/rss/articles/CBMib0FVX3lxTFBJSmx1NDdBNWRsNFU4LUNrWlBkTGZuWEtMMzI5OHhBczRoUlM2MnRXMGQ4ZGFuNHY3ZWN6bmFYTjZRWEo1SjRJOVJMb216MDRrMjhPcXBDd0tDazJBTkY4UFBFQ2g4SXpuRkE4UmpTNA?oc=5",
        "source": "Google News"
      },
      {
        "title": "Battleground Republicans are starting to worry about the Senate - Politico",
        "url": "https://news.google.com/rss/articles/CBMikwFBVV95cUxNaVhCYjd1azRYTnpqSEpoT3dzZXp5cEw3a3BzR3ZNa1k1Y3VobUJ5M2lraktkeFAyRWotLW9LQ2RnTFgycEtmTlFENnVzY21sUE96d2VKQ1FhRHFaazIzWExCaVpPSDViSTZMcDloT3RKMkZZUW51dzFBR3lRNVpWdTdKVElhWDJGSWZ1S2hLeElGSk0?oc=5",
        "source": "Google News"
      }
    ],
    "global": [
      {
        "title": "A mass shooting in Ukraine's capital leaves 6 dead before police shot and killed the gunman - NPR",
        "url": "https://news.google.com/rss/articles/CBMie0FVX3lxTE9qc0NsdUtYd2pkV0pZVG5XVVNpXzF6VDJhcmM1eVY0eFRpRXowQ3FOZGZ0ZnhLOGFtQ3Nkd2huQVctbDhPLWl0RW05LVBSOEtIZWpqclhqcUg1RUU1V19SUHlUeUR4U3o1R19aNzR3cXhTQlZoMFBGYTFMZw?oc=5",
        "source": "Google News"
      },
      {
        "title": "North Korea fires ballistic missiles again, flexing muscle amid Iran war - CNBC",
        "url": "https://news.google.com/rss/articles/CBMipAFBVV95cUxNWVUxUTEzOFZ1Uk01RGNvQ3NJM250MjJub3FFQUpIV1RDNFhvOGJKQ2s2dGwySGMwSTd6MmJRbU04eFdiUFVLdF9HUlZUcTlKLU14bHpaV1hBc05wLUhMX2RIYS1qT3hZQUs3LTF0SDlGejVCZVVIQXpldkxka0VvWjE1RzJzTEhLUkp1dXJ4Q2x0dDNEX3F1LUxNYXdsaHk1S2ZkdNIBqgFBVV95cUxPYWZGWnVRZUhTUFNXeTZxQm5EZmhKZ20zWUJpdXdKVUpiN0dyWVMyYkFTaG5Wd0dDQXpOclhnVnBqXzU0c19mUVVad3NUWC12QmZlWEtEc0NNc3pVSzVoN2tlWFFyTFd0ZmFhVDVwZHVzaG9mTVVRc1ZZWjV1aU9IX0JKV1V4YkF2cXZ2YVBDMVZnQXVyaGpnN21pRHlmRjBNYnR6eFBVd0dvQQ?oc=5",
        "source": "Google News"
      },
      {
        "title": "In Angola, love for an American pope but not for an American president - The Washington Post",
        "url": "https://news.google.com/rss/articles/CBMigwFBVV95cUxNTVFmUm51akNrN3dHejhkTGZ0Z3lOdkZ6LTJwR2tCN1RqNE5xbk9Pa1hBSHBacFdLazVxZVNvSFdGU01feGYwOWcyUmJ4elpXYUk0emRSbFNVOVkya1M0TG1wbmI5UG1wTm5OT2pQTFdBM3pzVWJoS2JyMkloQWVSLXdSWQ?oc=5",
        "source": "Google News"
      }
    ],
    "tech": [
      {
        "title": "The App Store is booming again, and AI may be why - TechCrunch",
        "url": "https://news.google.com/rss/articles/CBMiiwFBVV95cUxQUDV4WmVoTVlmTWwzUXpPTkE3VF9vYUh6WVVCTVlLZnU5VVZmSXlmRng1VnJpcTBRdkxoQ0gxVzhhXzZDSWhJRVRUV1luQmhIR1ktNXdDNTN2UUFDVnFJZ09aWG1MNHk5ZXNRVEpPeHUxQUNicDBqNy1kdGlfYnBfUGliVEEyb1Z1MzJN?oc=5",
        "source": "Google News"
      },
      {
        "title": "Pixel Laptop: Return of Google Pixelbook laptops spotted in new OS release - Notebookcheck",
        "url": "https://news.google.com/rss/articles/CBMiugFBVV95cUxOaVo3a3p3dWNXRFhPQjdJYTF1T3laSWNOaG9Pb2tYYVNROExqS0lyNkYteUFLSWhRcndrQURLbm90OHgwUmFPRGJoUXVPWGJMTDVLdV9USkZuMEt0TFNoT09nRzRHYWtxSG0zQnI5VDVpQVRVSmhEdTRHYXpUTGxmQnJ3aGxmaGJrWkN6ZVQxMG1BUzVfLUFxN1pGeUN5a0o3a2Q1X3VJdFMtUWFxTXBRMGpUUnBNTlpEX0E?oc=5",
        "source": "Google News"
      },
      {
        "title": "Huawei Pura X Max live images leaked ahead of April 20 launch - Huawei Central",
        "url": "https://news.google.com/rss/articles/CBMilwFBVV95cUxPSU1LM1RXZ09jTUtIOFpqMEdfRjhvaDZPSnByY0xBS2ZoZko4RkpOUXAwRF96SEs4U1BodzlXY01weVhCbUNvMmpxOTJRNVRUT0xxc3hDT0ZkZXJFNms3VGhGTHRfdjF1YzltYUYxZTh5TXJXeTk4Zm1iV1RSY2wwWTBKazJFU0YxNHpLQndvaEh5UmNHSEFn0gGcAUFVX3lxTE4tWlNhczV2UWNKV0c0aDRRaXF6cmx1ZUNqUHJMTEpVYVQ2UkFOS2R1bUlkenhaZG5GUmRQM0twOTUzVXg4Z0kxQWNySkROOHYwNTVNYmtweFhtR2R0QTI5RXNXVDRjOVB2QmhfVkJWQ0lnOUJTS1B2bDIzcUdrbTRvOW5MdU91SXFrNGxueUxpelJOOWt0U3Jad0JtYg?oc=5",
        "source": "Google News"
      }
    ]
  },
  "guitarExercise": "20-minute modern fusion workout in E Dorian: 5 minutes alternate-picked 3NPS shapes at 92-112 BPM, 7 minutes triad-pair phrasing (Em/G and A/C) over i-IV vamp, 8 minutes motif development with rhythmic displacement and intentional rests.",
  "codingPrompt": "Design a principal-level control plane for autonomous AI agents with deterministic replay, tenant-scoped policy sandboxes, and cost-aware scheduling. Define event contracts, failure domains, observability SLOs, and a zero-downtime migration from single-region active/passive to multi-region active/active.",
  "quote": {
    "text": "Quality is never an accident; it is always the result of intelligent effort.",
    "author": "John Ruskin"
  },
  "audio": {
    "src": "./brief-podcast.mp3",
    "maxMinutes": 6
  }
}
