{
  "date": "2026-05-16",
  "location": "Reno, NV",
  "weather": "Reno, NV: Clear morning around 50\u00b0F, afternoon high near 76\u00b0F, light winds, dry conditions.",
  "sections": {
    "local": [
      {
        "title": "This Nevada city is the first to pause new data centers - Las Vegas Review-Journal",
        "url": "https://news.google.com/rss/articles/CBMisAFBVV95cUxNWWYzakd6djI0Nk1HdTlpNVgwUjd1S05kZUhvYXZSdjRZZmUydmRyUUJGaThoLTFwWF82VGZ0bHZQbXk5OGkxWGFHMFJJdjVrelRZZTl2SkdtZzBoREhzUC1tTldzVlZIbmN2WDBrZ21ZV0FtdDA3RmFoYnlKclNVV0JJVVJMTTlkOGVlSUdZVzVNTnhkSEJObUZsYVY3SXRMUll1OTJwc0tkeVp3Mmg5aw?oc=5",
        "source": "Las Vegas Review-Journal"
      },
      {
        "title": "SFB vs. Nevada MW Tournament (G2) - Grand Canyon University Athletics",
        "url": "https://news.google.com/rss/articles/CBMiVkFVX3lxTE8xaXh0elNTUlZZZi1QVzkwTUltTS1CVzVQeFFZUGVpc19vblhMdXRSX2FmbTFLNHZESjBtQ3VPalRNSzQ3T19Wc3RBemZNaDNvdjdNUUFn?oc=5",
        "source": "Grand Canyon University Athletics"
      },
      {
        "title": "Chris Murray - Nevada Sports Net",
        "url": "https://news.google.com/rss/articles/CBMiZkFVX3lxTFByRjhfMnU2NFcydkxaakt5dUstR3VtUmxuT0ZrSXhlSnNmUUl1Mm1Wa0Y4UW9DaUlEWlBJOEZFRmFPVzhRcXBiZy05YXBUaER2aHR1a2ktTElrSnlIMUdaeXc4MXZ1Zw?oc=5",
        "source": "Nevada Sports Net"
      }
    ],
    "national": [
      {
        "title": "Texas Children\u2019s will create \u2018detransition clinic\u2019 to settle DOJ and state investigation - NBC News",
        "url": "https://news.google.com/rss/articles/CBMirwFBVV95cUxNWldtbklUX2djdGRmOWp3bHpFclFqdkVEcFluTjN1SXA1Rm9DV1J2NTEzbl8tblJfdmVwMU5WcHI4eDlDelVWQVBpWndiMVJOb3hQV3JlVjlCQ0FyRE1tNW5hd2FLLUVvb3VKZVp3NlZUU29CYWJEdUNfdjU1b090R3U4U295YzBMZTJoR0ZYQVZ6TlV2YURFYXcwLTYyMTlkem5xUldsa0xiS1B0NEM4?oc=5",
        "source": "NBC News"
      },
      {
        "title": "Tennessee\u2019s sole congressional Democrat won\u2019t run again after redistricting - The Washington Post",
        "url": "https://news.google.com/rss/articles/CBMiwwFBVV95cUxQd0J0Yk5pdG1LbFdSalJxMG9hUVRyQXhHakJPamRuTDhfMjNKRHAzR1ZnaVNDbnZqMmszRGNUaUJQY2RVTnBmdDNUUmJuY083ejU5QmFfSlpDRUFGN0lLeGdHakhKY1pVU2dlVUVZdjZGeHhBekJHSjU2eVhuUkg1ankwVUdiUVJVcWdFXy14VjQyQnRmYThCV0RxWTBhTWFEVDc0YjZtRXZXejZnY3lVWTR2aDYwbl9JaVo1akhtMWZoRTQ?oc=5",
        "source": "The Washington Post"
      },
      {
        "title": "Trump Just Gave China\u2019s President Exactly What He Wanted - Slate",
        "url": "https://news.google.com/rss/articles/CBMioAFBVV95cUxNLXNXWXc2ME9WNFgwQmp6YnFVNTBxYnVfVWtKOW9ybkxDSU15RGl2eXRwajRXTy1OUXRrUjZhNWxEekVwRnl4ZEhiSUpJWTNmN2xFRFFtUHJic0xMRGNGd1B3ZWwtX2EtcTFwTm1PZlE5TTcwRXRKVUpkVGlWLUVxUTAwWDExdVdFdGRlQjB1bGRWUUpWQTJyeG5UM1VqS0tr?oc=5",
        "source": "Slate"
      }
    ],
    "global": [
      {
        "title": "Israel's military says Gaza strike kills Hamas armed wing leader Haddad - Reuters",
        "url": "https://news.google.com/rss/articles/CBMizgFBVV95cUxOOXRieDYzVldHX1ZQNDRVQ21ZWmdZelQ0QWdJc1FaOEJnUzNNMWZqbC16QUpBYUZ0OER2RFhCTm5YZXk5S3FhQ0psZ2FlR1FsdnpiczZiM3M4ODNfVGtuTWlYRWhIRFRBalFPdUxQc0k0TlpLNU1FNTBGbU9YUVRWZ0ttRVFGQk5rb1JoZVo0cS1CbzZCR1RVSmswZmJmeUZTNHJBWDZrcTdFOFBIa1phY2dVX1F3YUFTcmdEYzVGaUg2ejYyUHZ6RmtwSVdNUQ?oc=5",
        "source": "Reuters"
      },
      {
        "title": "Rival Protests Begin in London, With a Major Security Effort - The New York Times",
        "url": "https://news.google.com/rss/articles/CBMif0FVX3lxTE1INHpTTTRsemI4elZoOVlsb2lYRExSdFlvdlZENjdia3M2X0NGMTFsTmRHNkZkV0JURzl2eENrZDJFVVUzaDZ6b2pqSFpJQlNFYkNNTE9FeFpteDBJY013U0JVNk5oMThrdWxNSVZySGxCLWg1cHBvbUtSZERQZkU?oc=5",
        "source": "The New York Times"
      },
      {
        "title": "Pope Leo XIV to visit France in September this year - Vatican News",
        "url": "https://news.google.com/rss/articles/CBMiuAFBVV95cUxPNHdqVmpIei1zbXROaUlSeGV1V1dreHZ5eThjemZ0aUZmX1ppbVliOHc5amNQSlRRYjNSenh0WDF6eTk1Y0txRDBGZUlpZ3dSSDlRV1BWVFlFTlpvSlVJMndBN0VCX1plTkR0WTBObWdsaklYOWZhVnpJb1BFdkllb0x4N1BTRXVjOXg0ZEQ3a1hLV2xyQjBmcmItZmstbk83TVhodE0wR0wxREI0Z09pTzFiYUFOdHBu?oc=5",
        "source": "Vatican News"
      }
    ],
    "tech": [
      {
        "title": "Fitbit 4.69 rolls out with redesign of focus stats and logging - 9to5Google",
        "url": "https://news.google.com/rss/articles/CBMiWkFVX3lxTE1nOVFOVjRjVGdLb2pYbmNmX09UZ2szN1Vnelo2TlZNckVHN3czN3BNOXZUelByanFHRllTcUtNQUVLV25ySzhsVzMtQy1kQXZrazViOVJ3bnNmdw?oc=5",
        "source": "9to5Google"
      },
      {
        "title": "Why You Shouldn\u2019t Leave iOS 26.5 Settings on Default - Geeky Gadgets",
        "url": "https://news.google.com/rss/articles/CBMiakFVX3lxTFBGdURRbVdoSHYyV1E3aUcwZVVEeVdYUWhNbGVsa2w3a1JJMUQ1SV90b2ZNRjl1Z1F6VmVZVE9vWFdmUXdsT3dyN211SVVXeTRYNW5RVDE0eXFORldkQUJRSWFxTkNyOTBSZlE?oc=5",
        "source": "Geeky Gadgets"
      },
      {
        "title": "Long-awaited Xbox Elite Series 3 controller leaks in photos from Brazilian government body - Digital Foundry",
        "url": "https://news.google.com/rss/articles/CBMizwFBVV95cUxQNVdtcE83YWJyYmZvRFNoQy0temZiTWhpVXExY2MwSnRoS1lGLUNfRUZZalpFZW9YZnNTZVNaSGVsVWhMYXMwZ3NZQ1JIUTFKQU9mVmx4cUltbUstUkYzbTJ1a1MxbXkwRjBxcHdYOFNNcjBrZEdXMTlLcDUxc3Nsa1FwM2k5WW5nSW9mSzIydzdDVXJlWWhzOTF1OXFLM1ZGMVdONEczZk50X1hTTUVzN09jbXllQVlzZTlCVE1kRDZpbmJLbzkwT3FhUUFrY3M?oc=5",
        "source": "Digital Foundry"
      }
    ]
  },
  "guitarExercise": "15-minute exercise: E minor alternate-picking ladder at 90-110 BPM for 8 minutes, then 7 minutes of hybrid-picked chord-tone targeting over Em9-A13 with clean muting.",
  "codingPrompt": "Principal-level problem: Design a deterministic multi-tenant workflow orchestration control plane for AI agents with replay-safe execution, policy-gated approvals, and cost-aware scheduling across regions. Define architecture, invariants, consistency model, failure domains, SLOs, and migration strategy.",
  "quote": {
    "text": "Success is the sum of small efforts, repeated day in and day out.",
    "author": "Robert Collier"
  },
  "audio": {
    "src": "./brief-podcast.mp3",
    "maxMinutes": 6
  }
}
